index,published,topic,term,domain,language,valid,de,title,description,en,la,url,image,archive,content,quote,added,feed,country,ipcc,continent
20e70df1f3396a3e3d9d862817ecedb2,2026-06-10T12:00:00Z,Snow&Ice,Eis Deutschland,www.nzz.ch,de,0.7,Wer wird Weltmeister? Und welche Titelanwärter sind in Form? Die historischen Granden Brasilien und Deutschland zählen nicht zum engsten Favoritenkreis. Vor jeder Endrunde gibt es mehr oder weniger elaborierte Formen des Kaffeesatzlesens. Klar ist hingegen: Dem englischen Nationaltrainer Thomas Tuchel dürfte seine umstrittene Nominierung im Fall eines Misserfolgs um die Ohren fliegen.,Wer wird Weltmeister? Und welche Titelanwärter sind in Form? Die historischen Granden Brasilien und Deutschland zählen nicht zum engsten Favoritenkreis,Vor jeder Endrunde gibt es mehr oder weniger elaborierte Formen des Kaffeesatzlesens. Klar ist hingegen: Dem englischen Nationaltrainer Thomas Tuchel dürfte seine umstrittene Nominierung im Fall eines Misserfolgs um die Ohren fliegen.,"Who will be world champion? And which title contenders are in form? The historic grandees of Brazil and Germany are not among the closest favorites. Before each final round there are more or less elaborate forms of reading coffee grounds. What is clear, however, is that if he fails, his controversial nomination will blow up in the face of English national coach Thomas Tuchel.","Quis terrarum vindex erit? Et quo titulo contendunt in forma? Magnae historicae Brasiliae et Germaniae inter summos favores non sunt. Ante quamlibet finalem rotundationem plus minusve elaboratae formae legendi coffee loca sunt. Quod autem patet, si defecerit, nominatio controversa in facie raeda Anglica nationalis Thomas Tuchel conflabit.",https://www.nzz.ch/sport/fussball/wer-wird-weltmeister-und-welche-titelanwaerter-sind-in-form-die-historischen-granden-brasilien-und-deutschland-zaehlen-nicht-zum-engsten-favoritenkreis-ld.10010645,"https://img-msp-prod.nzz.ch/2026/06/10/6b19d81a-cf32-4d7f-8011-463994d8ecb8.jpg?width=1200&height=675&fit=bounds&quality=75&auto=webp&crop=2419,1361,x0,y73&wmark=nzz",,Vor jeder Endrunde gibt es mehr oder weniger elaborierte Formen des Kaffeesatzlesens. Klar ist hingegen: Dem englischen Nationaltrainer Thomas Tuchel dürfte seine umstrittene Nominierung im Fall eine… [+7772 chars],,2026-06-14 16:44:41+00:00,wmo,Germany,WCE,Europe
ecdd816442de340895c38b9da63e97c6,2026-06-13T22:03:01Z,Snow&Ice,Eis Argentinien,spielverlagerung.de,de,0.7,"Gruppe J: Weltmeister, WM-Rückkehrer, Herausforderer und Neuling – MH. Die Gruppe J der Weltmeisterschaft 2026 besteht aus Argentinien, Österreich, Algerien und Jordanien. Sowohl zu Argentinien als auch zu Österreich stehen ausführliche Teamanalysen zur Verfügung, die in diesem Artikel verlinkt sind. Ebenfalls gibt es eine Spiel…","Gruppe J: Weltmeister, WM-Rückkehrer, Herausforderer und Neuling – MH","Die Gruppe J der Weltmeisterschaft 2026 besteht aus Argentinien, Österreich, Algerien und Jordanien. Sowohl zu Argentinien als auch zu Österreich stehen ausführliche Teamanalysen zur Verfügung, die in diesem Artikel verlinkt sind. Ebenfalls gibt es eine Spiel…","Group J: World champions, World Cup returnees, challengers and newcomers – MH. Group J of the 2026 World Cup consists of Argentina, Austria, Algeria and Jordan. Detailed team analyzes are available for both Argentina and Austria, which are linked in this article. There is also a game…","Group J: pugiles mundi, reditus Trophaeum Mundi, provocatores et advenae – MH. Group J Mundi 2026 ex Argentina, Austria, Algeria et Iordane consistit. Detailed turmae analyses tam Argentina quam Austriae praesto sunt, quae hoc articulo nectuntur. Est etiam ludus…",https://spielverlagerung.de/2026/06/14/gruppe-j-weltmeister-wm-rueckkehrer-herausforderer-und-neuling-mh/,,,"Gruppe J: Weltmeister, WM-Rückkehrer, Herausforderer und Neuling – MH
von Next Generation am 14.06.2026 in den Kategorien Algerien,Argentinien,Jordanien,Österreich,WM 2026 mit 0 Kommentaren
Die Gru… [+19240 chars]",,2026-06-16 15:19:37+00:00,wmo,Argentina,SES,South-America
4ffa25eba95bc5b546a16fda723e39ba,2026-06-15T12:58:42Z,Thunderstorm,Unwetter Deutschland,www.tagesspiegel.de,de,0.8,„Beginn einer Hitzephase mit hoher Wärmebelastung“: Meteorologen erwarten bis zu 37 Grad – doch es drohen heftige Unwetter. Aktuell wird vielerorts noch gefröstelt. Doch nur Tage später prognostizieren Meteorologen in Deutschland eine Hitzewelle. Regional gibt es allerdings bis zu 17 Grad Temperaturunterschied.,„Beginn einer Hitzephase mit hoher Wärmebelastung“: Meteorologen erwarten bis zu 37 Grad – doch es drohen heftige Unwetter,Aktuell wird vielerorts noch gefröstelt. Doch nur Tage später prognostizieren Meteorologen in Deutschland eine Hitzewelle. Regional gibt es allerdings bis zu 17 Grad Temperaturunterschied.,"“Start of a heat phase with high heat load”: Meteorologists expect temperatures of up to 37 degrees – but there is a threat of violent storms. It's still freezing in many places at the moment. But just days later, meteorologists in Germany predicted a heat wave. However, regionally there is a temperature difference of up to 17 degrees.","""Initium caloris Phase cum magno onere caloris"": astrologi exspectant temperaturas usque ad 37 gradus – sed comminatio est tempestatum violentarum. Adhuc congelatio in multis locis in tempore est. Sed sicut dies post, astrologi in Germania aestum fluctum praedixerunt. Sed regionali differentia est temperatura usque ad 17 gradus.",https://www.tagesspiegel.de/gesellschaft/panorama/beginn-einer-hitzephase-mit-hoher-warmebelastung-meteorologen-erwarten-bis-zu-37-grad--doch-es-drohen-heftige-unwetter-15715033.html,https://www.tagesspiegel.de/images/15718441/alternates/BASE_16_9_W1400/1781600355000/hitzewelle-in-spanien.jpeg,,Wechselhaftes Aprilwetter mitten im Juni? Meteorologen des Deutschen Wetterdienstes (DWD) prognostizieren für die erste Wochenhälfte vielerorts ein launiges Wetter  doch bereits ab der Wochenmitte wi… [+7006 chars],,2026-06-17 13:52:11+00:00,wmo,Germany,WCE,Europe
1e8b3e7e1ac4887a43a75fd5adfe667e,2026-06-15T12:58:42Z,Thunderstorm,Unwetter Deutschland,www.tagesspiegel.de,de,0.8,„Beginn einer Hitzephase“: Deutscher Wetterdienst erwartet bis zu 38 Grad – doch es drohen heftige Unwetter. Aktuell wird vielerorts noch gefröstelt. Doch Meteorologen zufolge soll in Deutschland eine Hitzewelle mit „sehr starker Wärmebelastung“ bevorstehen. Auch Hitzegewitter mit Starkregen und Sturmböen soll es geben.,„Beginn einer Hitzephase“: Deutscher Wetterdienst erwartet bis zu 38 Grad – doch es drohen heftige Unwetter,Aktuell wird vielerorts noch gefröstelt. Doch Meteorologen zufolge soll in Deutschland eine Hitzewelle mit „sehr starker Wärmebelastung“ bevorstehen. Auch Hitzegewitter mit Starkregen und Sturmböen soll es geben.,"“Start of a heat phase”: The German Weather Service expects temperatures of up to 38 degrees – but there is a threat of severe storms. It's still freezing in many places at the moment. But according to meteorologists, a heat wave with “very strong heat stress” is imminent in Germany. There are also expected to be heat thunderstorms with heavy rain and squalls.","""Initium caloris tempus"": Tempestas Service Germanorum exspectat temperaturas usque ad 38 gradus – sed comminatio est tempestatum gravium. Adhuc congelatio in multis locis in tempore est. Sed, secundum astrologos, unda caloris cum ""calore vehementissimo accentus"" in Germania imminet. Tonitruum etiam calorum cum pluvia et procellis expectatur.",https://www.tagesspiegel.de/gesellschaft/panorama/beginn-einer-hitzephase-deutscher-wetterdienst-erwartet-bis-zu-38-grad--doch-es-drohen-heftige-unwetter-15715033.html,https://www.tagesspiegel.de/images/15718441/alternates/BASE_16_9_W1400/1781600355000/hitzewelle-in-spanien.jpeg,,"Wechselhaftes Aprilwetter mitten im Juni? Aktuell herrscht in Deutschland laut Meteorologen des Deutschen Wetterdienstes (DWD) noch unbeständiges Wetter vor, das ungemütliche Temperaturen mit sich br… [+5248 chars]",,2026-06-17 13:52:11+00:00,wmo,Germany,WCE,Europe
77dc5e1dd1018daa17f79eb3cb06f7ae,2026-06-15T12:58:42Z,Thunderstorm,Unwetter Deutschland,www.tagesspiegel.de,de,0.8,"Montag noch 16 Grad, Mittwoch schon 33: Hitzewelle ab Mitte der Woche erwartet – doch danach drohen Unwetter. Am Montag wird vielerorts noch gefröstelt. Nur Tage später prognostizieren Meteorologen in Deutschland eine Hitzewelle. Freitag könnten bis zu 37 Grad erreicht werden – doch es gibt Unterschiede.","Montag noch 16 Grad, Mittwoch schon 33: Hitzewelle ab Mitte der Woche erwartet – doch danach drohen Unwetter",Am Montag wird vielerorts noch gefröstelt. Nur Tage später prognostizieren Meteorologen in Deutschland eine Hitzewelle. Freitag könnten bis zu 37 Grad erreicht werden – doch es gibt Unterschiede.,"Monday still 16 degrees, Wednesday already 33: heat wave expected from the middle of the week - but afterwards there is a threat of storms. On Monday it will still be cold in many places. Just days later, meteorologists in Germany are predicting a heat wave. Friday could reach up to 37 degrees - but there are differences.","Lunae adhuc 16 gradus, mercurii iam 33: aestus expectat fluctum a media hebdomade - sed post tempestates minas est. Die Lunae adhuc multis locis frigidum erit. Sicut dies post, astrologi in Germania aestum fluctum praedicunt. Veneris usque ad 37 gradus pertingere potuit - sed sunt differentiae.",https://www.tagesspiegel.de/gesellschaft/panorama/montag-noch-16-grad-mittwoch-schon-33-hitzewelle-ab-mitte-der-woche-erwartet--doch-danach-drohen-unwetter-15715033.html,https://www.tagesspiegel.de/images/15717197/alternates/BASE_16_9_W1400/1781536714000/wetter-auf-mallorca.jpeg,,Wechselhaftes Aprilwetter mitten im Juni? Meteorologen des Deutschen Wetterdienstes (DWD) prognostizieren zum Wochenstart vielerorts ein launiges Wetter  doch wenig später wird in Deutschland bereits… [+7319 chars],,2026-06-17 13:52:11+00:00,wmo,Germany,WCE,Europe
5a15f03a7f916bf3d9345f588b19eda0,2026-06-10T14:27:48Z,Thunderstorm,Unwetter Deutschland,www.bild.de,de,0.8,"Unwetter-Serie reißt nicht ab - Regen-Dauerschleife bis zum Deutschland-Spiel. Schauer, Gewitter und ein spürbarer Kälterückschlag prägen das Wetter bis zum Wochenende.",Unwetter-Serie reißt nicht ab - Regen-Dauerschleife bis zum Deutschland-Spiel,"Schauer, Gewitter und ein spürbarer Kälterückschlag prägen das Wetter bis zum Wochenende.","Series of storms doesn't stop - continuous rain cycle until the Germany game. Showers, thunderstorms and a noticeable cold setback will characterize the weather until the weekend.","Series tempestatum non cessat - pluviae continuus cyclus usque ad ludum Germaniae. Imbres, tonitrua et incommodum notabile frigus tempestatum denotabunt usque ad volutpat vestibulum.",https://www.bild.de/news/wetter/unwetter-serie-reisst-nicht-ab-regen-dauerschleife-bis-zum-dfb-auftakt-6a27da5037d75abfaf736294,"https://images.bild.de/6a27da5037d75abfaf736294/40eaf6507931021b36b7c3f20987029b,9ef36b9b?w=1280",,"TTS-Player überspringenArtikel weiterlesenDeutschland steckt mitten in der Schafskälte statt frühsommerlicher Leichtigkeit dominieren derzeit Regen, graue Wolken und frische Temperaturen. Und eine sc… [+3844 chars]",,2026-06-17 17:52:10+00:00,wmo,Germany,WCE,Europe
2429d5541bd37b2dc5f54a65c0258596,2026-06-15T09:39:56Z,Snow&Ice,Eis Deutschland,www.sueddeutsche.de,de,0.7,Fußball-WM: Frankreich – ab jetzt mit vier Angreifern auf einmal. Didier Deschamps wurde mit pragmatischem Defensivfußball Weltmeister. Doch spätestens bei der EM in Deutschland wirkte der Ansatz mutlos. Die Reaktion des Trainers: Er stellt nun alle seine Superangreifer gleichzeitig auf.,Fußball-WM: Frankreich – ab jetzt mit vier Angreifern auf einmal,Didier Deschamps wurde mit pragmatischem Defensivfußball Weltmeister. Doch spätestens bei der EM in Deutschland wirkte der Ansatz mutlos. Die Reaktion des Trainers: Er stellt nun alle seine Superangreifer gleichzeitig auf.,"Football World Cup: France – from now on with four attackers at once. Didier Deschamps became world champion with pragmatic defensive football. But at the latest at the European Championships in Germany, the approach seemed discouraged. The trainer's reaction: He now sets up all of his super attackers at the same time.",Eu World Cup: Gallia – posthac cum quattuor simul oppugnatoribus. Didier Deschamps factus est assertor mundi cum pragmatica eu defensiva. Sed ad tardus ad Championships Europaeos in Germania accessus dissolutus videbatur. Exercitatoris reactionem: Nunc omnes suos superexpugnatores simul erigit.,https://www.sueddeutsche.de/sport/fussball-wm-frankreich-ab-jetzt-mit-vier-angreifern-auf-einmal-li.3498664,https://www.sueddeutsche.de/2026/06/15/be0cc32a-4d2d-4031-8177-cbd71af54b3b.jpg?q=60&fm=webp&width=1200&rect=0%2C127%2C2428%2C1366,,"So naheliegend der Vergleich ist, so schief ist er auch. Deschamps war, anders als Löw, schon Weltmeister, ehe er ins Trainerfach wechselte: als Kapitän jener Elf, die 1998 in der Heimat triumphierte… [+5682 chars]",,2026-06-18 09:22:50+00:00,wmo,Germany,WCE,Europe
f13749cf5110c36efabd9a6230eb7c91,2026-06-16T17:34:04Z,Snow&Ice,Eis Argentinien,sport.orf.at,de,0.7,"Argentinien setzt auf Teamgeist und Messi. Titelverteidiger Argentinien steigt in der Nacht auf Mittwoch (ab 2.50 Uhr, live in ORF1, Anpfiff: 3.00 Uhr) in der Österreich-Gruppe J mit dem Spiel gegen Algerien in die WM 2026 ein. In Kansas City werden alle Augen auf Kapitän Lionel Messi gerichtet sein, …",Argentinien setzt auf Teamgeist und Messi,"Titelverteidiger Argentinien steigt in der Nacht auf Mittwoch (ab 2.50 Uhr, live in ORF1, Anpfiff: 3.00 Uhr) in der Österreich-Gruppe J mit dem Spiel gegen Algerien in die WM 2026 ein. In Kansas City werden alle Augen auf Kapitän Lionel Messi gerichtet sein, …","Argentina relies on team spirit and Messi. Defending champion Argentina will enter the 2026 World Cup in Austria Group J on Wednesday night (from 2:50 a.m., live on ORF1, kick-off: 3:00 a.m.) with the game against Algeria. In Kansas City, all eyes will be on captain Lionel Messi,...","Argentina innititur quadrigis spiritu et Messi. Defensor propugnator Argentinae in Austria 2026 Mundus Calicem in Austria Group J intrabit die Mercurii (ab 2:50 a.m., vive in ORF1, calcitrant-off: 3:00 a.m.) cum ludo contra Algeria. In Kansas urbe omnes oculi erunt in Leonello Messi capitaneo,...",https://sport.orf.at/stories/3157252/,https://ibs.orf.at/sport?image=https%3A%2F%2Fassets.orf.at%2Fmims%2F2026%2F25%2F35%2Fcrops%2Fw%3D1200%2Ch%3D630%2Cq%3D75%2F3073822_master_1190035_fus_wm_gruppe_j_argentinien_algerien_vor_afp.jpg%3Fs%3D6e5b51324d4214eefe51b68228919b2f06ebf33d,,"Der polnische Referee hatte vor vier Jahren das Endspiel in Katar geleitet, das die Argentinier gegen Frankreich im Elfmeterschießen für sich entschieden hatten, und darf nun gleich wieder die Südame… [+2481 chars]",,2026-06-18 09:22:50+00:00,wmo,Argentina,SES,South-America
31b5e19d1c308c59eb6b85da3a12c317,2026-06-15T12:58:42Z,Heat Wave,Hitzewelle-Innsbruck-Land,www.tagesspiegel.de,de,0.3,"Amtliche Warnungen für sechs Bundesländer: Hitzewelle aus Südwesten sorgt für Temperaturen bis zu 38 Grad – doch es drohen heftige Unwetter. , Am Donnerstag startet nach Angaben des Deutschen Wetterdienstes eine Hitzewelle mit teils „extremer Wärmebelastung“. Doch die schwülheiße Luft soll Gewitter, Starkregen und Sturmböen mit sich bringen.",Amtliche Warnungen für sechs Bundesländer: Hitzewelle aus Südwesten sorgt für Temperaturen bis zu 38 Grad – doch es drohen heftige Unwetter,", Am Donnerstag startet nach Angaben des Deutschen Wetterdienstes eine Hitzewelle mit teils „extremer Wärmebelastung“. Doch die schwülheiße Luft soll Gewitter, Starkregen und Sturmböen mit sich bringen.","Official warnings for six federal states: Heat wave from the southwest causes temperatures of up to 38 degrees - but there is a threat of severe storms. , According to the German Weather Service, a heat wave with sometimes “extreme heat stress” will start on Thursday. But the hot, humid air is expected to bring thunderstorms, heavy rain and squalls.","Monitiones officiales pro sex civitatibus foederati: Fluctus caloris ab occasu brumali causat temperaturas usque ad 38 gradus — sed comminatio est tempestatum gravium. Iuxta Servitium Tempestatis Germanicae, fluctus aestus cum interdum ""extremi caloris accentus"" die Iovis incipiet. Sed calidus, humidus aer expectatur tonitribus, gravibus pluviis et procellis.",https://www.tagesspiegel.de/gesellschaft/panorama/amtliche-warnungen-fur-sechs-bundeslander-hitzewelle-aus-sudwesten-sorgt-fur-temperaturen-bis-zu-38-grad--doch-es-drohen-heftige-unwetter-15715033.html,https://www.tagesspiegel.de/images/15718441/alternates/BASE_16_9_W1400/1781600355000/hitzewelle-in-spanien.jpeg,,Deutschland steuert auf die erste Hitzewelle des Jahres zu. Meteorologen des Deutschen Wetterdienstes (DWD) prognostizieren für den heutigen Donnerstag den Beginn einer längeren Hitzephase mit starke… [+6252 chars],,2026-06-18 13:37:10+00:00,wmo,Austria,WCE,Europe
291060d8eb604cef00f0ca57807bb0bc,2026-06-14T12:52:25Z,Precipitation,Regen Deutschland,www.bild.de,de,0.8,Wetter zum Deutschland-Spiel - Heute regnet es nicht nur Tore!. Zum WM-Auftakt der DFB-Elf am Sonntagabend ist in Deutschland vielerorts Regen angesagt.,Wetter zum Deutschland-Spiel - Heute regnet es nicht nur Tore!,Zum WM-Auftakt der DFB-Elf am Sonntagabend ist in Deutschland vielerorts Regen angesagt.,Weather for the Germany game - Today it's not just raining goals! Rain is forecast in many places in Germany for the DFB team's start to the World Cup on Sunday evening.,Tempestas pro ludo Germaniae - Hodie proposita non modo pluit! Pluribus locis in Germania praenuntiatur pluvia propter initium quadrigis DFB ad Calicem Mundi die dominico vesperi.,https://www.bild.de/news/wetter/regen-zum-deutschland-spiel-erwartet-wo-der-anpfiff-ins-wasser-faellt-6a2bf8f40573682fee38b510,"https://images.bild.de/6a2bf8f40573682fee38b510/c13e6cd96253ba2348922fc9ec77437a,936aaa87?w=1280",,TTS-Player überspringenArtikel weiterlesenUm 19 Uhr rollt heute der Ball. Doch spielt auch das Wetter mit? Viele Fußballfans wollen den WM-Auftakt der deutschen Nationalmannschaft gegen Curaçao im ei… [+3418 chars],,2026-06-18 13:37:10+00:00,wmo,Germany,WCE,Europe
e2685841ef1fc482cf05877385116284,2026-06-15T12:41:19Z,Heat Wave,Hitzewelle Baden,www.stern.de,de,0.8,"DWD-Prognose: Hitze im Südwesten: Was jetzt auf Baden-Württemberg zukommt. Mehr als 35 Grad, erste Tropennächte und ungewöhnlich hohe Temperaturen für Mitte Juni: Baden-Württemberg steht vor einer Hitzewelle. Was man dazu wissen sollte.",DWD-Prognose: Hitze im Südwesten: Was jetzt auf Baden-Württemberg zukommt,"Mehr als 35 Grad, erste Tropennächte und ungewöhnlich hohe Temperaturen für Mitte Juni: Baden-Württemberg steht vor einer Hitzewelle. Was man dazu wissen sollte.","DWD forecast: Heat in the southwest: What's coming to Baden-Württemberg now. More than 35 degrees, the first tropical nights and unusually high temperatures for mid-June: Baden-Württemberg is facing a heat wave. What you should know about it.","DWD praenuntio: Calor in Africo: Quid nunc Baden-Württemberg venit. Plus quam 35 gradus, noctes tropicae primae et temperaturae solito mediae Iunii: Baden-Württemberg respicit undam caloris. quid de eo scire debeatis.",https://www.stern.de/gesellschaft/regional/baden-wuerttemberg/dwd-prognose--hitze-im-suedwesten--was-jetzt-auf-baden-wuerttemberg-zukommt-37547224.html,https://image.stern.de/37547226/t/nv/v1/w1440/r1.7778/-/15--xvobim2mlcv1axs2048jpeg---ee7b5a86ca8d91a7.jpg,,"Kopiere den aktuellen Link
Zur Merkliste hinzufügen
Mehr als 35 Grad, erste Tropennächte und ungewöhnlich hohe Temperaturen für Mitte Juni: Baden-Württemberg steht vor einer Hitzewelle. Was man daz… [+5071 chars]",,2026-06-18 13:37:10+00:00,wmo,Austria,WCE,Europe
cc3d55b060e182acc69826062e98753f,2026-06-17T12:01:32Z,Heat Wave,Hitzewelle Baden,www.stern.de,de,0.8,"Hitzewelle: Paris erlaubt das Baden im Canal Saint-Martin. Kurz vor der nächsten Hitzewelle hat Paris das Baden im Canal Saint-Martin erlaubt: Wie der Pariser Bürgermeister Emmanuel Grégoire mitteilte, sollen sich die Menschen ab Mittwochnachmittag in einem Abschnitt des Kanals im Osten der französischen Hauptstadt a…",Hitzewelle: Paris erlaubt das Baden im Canal Saint-Martin,"Kurz vor der nächsten Hitzewelle hat Paris das Baden im Canal Saint-Martin erlaubt: Wie der Pariser Bürgermeister Emmanuel Grégoire mitteilte, sollen sich die Menschen ab Mittwochnachmittag in einem Abschnitt des Kanals im Osten der französischen Hauptstadt a…","Heat wave: Paris allows swimming in the Canal Saint-Martin. Shortly before the next heat wave, Paris has allowed swimming in the Canal Saint-Martin: As Paris Mayor Emmanuel Grégoire announced, people will be allowed to swim in a section of the canal in the east of the French capital from Wednesday afternoon...","Fluctus æstus: Paris natantes in Canal Saint-Martin concedit. Paulo ante aestus proximus undam, Paris natantibus in Canal Saint-Martin permisit: Paris Mayor Emmanuel Grégoire denuntiavit, homines in sectione canalis Galliae orientalis in urbe meridiano natare licebit.",https://www.stern.de/news/hitzewelle--paris-erlaubt-das-baden-im-canal-saint-martin-37559588.html,https://image.stern.de/37559590/t/Wd/v1/w1440/r1.7778/-/17--zwei-jugendliche-springen-in-den-canal-saintmartin---01d94328a9f6f3c1.jpg,,"Kopiere den aktuellen Link
Zur Merkliste hinzufügen
Kurz vor der nächsten Hitzewelle hat Paris das Baden im Canal Saint-Martin erlaubt: Wie der Pariser Bürgermeister Emmanuel Grégoire mitteilte, so… [+2100 chars]",,2026-06-18 13:37:10+00:00,wmo,Austria,WCE,Europe
2440214ccb35c67ec80135eae34493d7,2026-06-17T13:22:39Z,Heat Wave,Hitzewelle Baden,www.zeit.de,de,0.8,Frankreich: Paris erlaubt Baden im Canal Saint-Martin wegen Hitze. Wegen der erwarteten Hitzewelle gibt Paris einen Abschnitt des Canal Saint-Martin zum Baden frei. Die Stadt reagiert damit auf Erfahrungen aus dem Mai.,Frankreich: Paris erlaubt Baden im Canal Saint-Martin wegen Hitze,Wegen der erwarteten Hitzewelle gibt Paris einen Abschnitt des Canal Saint-Martin zum Baden frei. Die Stadt reagiert damit auf Erfahrungen aus dem Mai.,"France: Paris allows swimming in Canal Saint-Martin due to heat. Because of the expected heat wave, Paris is opening a section of the Canal Saint-Martin for swimming. The city is reacting to experiences from May.","Gallia: Paris natantibus in Canal Saint-Mart ob calorem concedit. Ob undam caloris expectatam, Lutetia sectio Canalis Saint-Mart ad natandum aperitur. Urbs a Maio experientias reagit.",https://www.zeit.de/gesellschaft/2026-06/paris-baden-canal-saint-martin-hitzewelle,https://img.zeit.de/gesellschaft/2026-06/paris-baden-canal-saint-martin-hitzewelle-foto-1/wide__1300x731,,"Paris hat kurz vor der nächsten Hitzewelle das Baden im Canal Saint-Martin erlaubt. Wie der Pariser Bürgermeister Emmanuel Grégoire mitteilte, können sich Menschen ab Mittwochnachmittag in einem Absc… [+1548 chars]",,2026-06-18 13:37:10+00:00,wmo,Austria,WCE,Europe
5a3b3c62f787abae9db633a1b4ef4a31,2026-06-17T13:29:59Z,Heat Wave,Hitzewelle Baden,www.zeit.de,de,0.8,Hitzewelle rollt: Was Baden-Württembergs Gesundheitsminister zur Hitze rät. Hier finden Sie Informationen zu dem Thema „Hitzewelle rollt“. Lesen Sie jetzt „Was Baden-Württembergs Gesundheitsminister zur Hitze rät“.,Hitzewelle rollt: Was Baden-Württembergs Gesundheitsminister zur Hitze rät,Hier finden Sie Informationen zu dem Thema „Hitzewelle rollt“. Lesen Sie jetzt „Was Baden-Württembergs Gesundheitsminister zur Hitze rät“.,Heat wave is rolling: What Baden-Württemberg's health minister advises about the heat. Here you will find information on the topic “Heat wave is rolling”. Now read “What Baden-Württemberg’s Health Minister advises about the heat”.,"Fluctus aestus volvitur: Quid minister salutis Baden-Württemberg monet de calore. Hic reperies informationem in loco ""Aestus fluctus volvitur"". Nunc lege ""Quid Baden-Württemberg minister Valetudinis Suae de aestu"".",https://www.zeit.de/news/2026-06/17/was-baden-wuerttembergs-gesundheitsminister-zur-hitze-raet,https://img.zeit.de/news/2026-06/17/was-baden-wuerttembergs-gesundheitsminister-zur-hitze-raet-image-group/wide__1300x731,,"Trinken, Schatten suchen, aufeinander achten: Vor der bevorstehenden Hitzewelle mit Temperaturen bis 35 Grad ruft Gesundheitsminister Oliver Hildenbrand (Grüne) die Menschen in Baden-Württemberg zur … [+1485 chars]",,2026-06-18 13:37:10+00:00,wmo,Austria,WCE,Europe
