index,published,topic,term,domain,language,valid,de,title,description,en,la,url,image,archive,content,quote,added,feed,country,ipcc,continent
eda4875210b701726a6fb753169045dd,2026-04-17T04:57:06Z,Storm,Sturm Werdenberg,www.tagesspiegel.de,de,0.6,"Stechmücken in Island entdeckt: Große Folgen fürs Ökosystem. Island war einer der wenigen Orte der Erde, die von Stechmücken verschont waren. Dass die Blutsauger jetzt auch dort gefunden wurden, ist für Forscherinnen Teil eines größeren Wandels in der Arktis.",Stechmücken in Island entdeckt: Große Folgen fürs Ökosystem,"Island war einer der wenigen Orte der Erde, die von Stechmücken verschont waren. Dass die Blutsauger jetzt auch dort gefunden wurden, ist für Forscherinnen Teil eines größeren Wandels in der Arktis.","Mosquitoes discovered in Iceland: Major consequences for the ecosystem. Iceland was one of the few places on earth spared from mosquitoes. For researchers, the fact that the bloodsuckers have now been found there is part of a larger change in the Arctic.","Culices inventae in Islandia: Maiores consectariis ad oecosystematis. Erat Islandia inter pauca loca in terra a culicibus relieta. Investigatores enim, eo quod exsuctores nunc reperti sunt, pars maioris mutationis in arctica est.",https://www.tagesspiegel.de/wissen/stechmucken-in-island-entdeckt-grosse-folgen-furs-okosystem-15488832.html,https://www.tagesspiegel.de/images/15488833/alternates/BASE_16_9_W1400/1776401759000/ringelmucke.jpeg,,"Viele empfinden sie vor allem als lästig, doch ihre Rolle in der Ökologie ist nicht zu unterschätzen: Stechmücken. Den Fund einiger Exemplare auf der Vulkan- und Eisinsel Island sieht ein Forschungst… [+2381 chars]",,2026-04-19 06:51:08+00:00,wmo,Switzerland,WCE,Europe
27aa9d997766ea7b41dac2d43c72c901,2026-04-16T03:02:33Z,Storm,Sturm Eisenstadt Stadt,www.tagesspiegel.de,de,0.7,"Herausfordernder Zug-Alltag: „Eisenbahner mit Herz“: Im Schnee zum Retter in der Not. Oft trifft sie der Unmut der Fahrgäste. Erst kürzlich starb ein Zugbegleiter nach einem Angriff. In Gedenken an ihn startet eine Ehrung für Eisenbahner, die besonders viel Menschlichkeit zeigen.",Herausfordernder Zug-Alltag: „Eisenbahner mit Herz“: Im Schnee zum Retter in der Not,"Oft trifft sie der Unmut der Fahrgäste. Erst kürzlich starb ein Zugbegleiter nach einem Angriff. In Gedenken an ihn startet eine Ehrung für Eisenbahner, die besonders viel Menschlichkeit zeigen.","Challenging everyday train life: “Railroad worker with a heart”: In the snow to the rescuer in an emergency. They are often affected by the displeasure of passengers. Just recently, a train conductor died after an attack. In his memory, a tribute is being launched for railway workers who show a particularly great deal of humanity.","Vita quotidiana instituendi provocans: ""Railroad cor opificum"": In nivibus servatori in casu. Saepe viatorum offensione afficiuntur. Nuper post oppugnationem conductor tramen mortuus est. In eius memoria merces operae ferriviariae immittuntur, quae maxime humanitatis speciem prae se ferunt.",https://www.tagesspiegel.de/gesellschaft/panorama/herausfordernder-zug-alltag-eisenbahner-mit-herz-im-schnee-zum-retter-in-der-not-15481642.html,https://www.tagesspiegel.de/images/15481701/alternates/BASE_16_9_W1400/1776313602000/eisenbahner-mit-herz.jpeg,,"Dreieinhalb Stunden steckt ein voller Regionalzug im Schneechaos fest, es ist spät am Abend, Verzweiflung macht sich breit. Doch einer bewahrt die Ruhe: Zugbegleiter Ronald-Phillip Tolkiehn. Er kümme… [+3809 chars]",,2026-04-19 06:51:08+00:00,wmo,Austria,WCE,Europe
3d87999bf935e979b6b5b3064cc4c554,2026-04-15T18:01:49Z,Drought,Dürre Österreich,www.diepresse.com,de,0.8,"Hochwasser, Dürre, Hangrutschungen: RiskLab zeigt, was passieren könnte [premium]. Wie verletzlich ist Österreich, wenn sich der Klimawandel weiter verschärft? Im RiskLab bei Geosphere Austria schätzt man Schäden ab, bevor sie eintreten – und entwickelt Handlungsempfehlungen.","Hochwasser, Dürre, Hangrutschungen: RiskLab zeigt, was passieren könnte [premium]","Wie verletzlich ist Österreich, wenn sich der Klimawandel weiter verschärft? Im RiskLab bei Geosphere Austria schätzt man Schäden ab, bevor sie eintreten – und entwickelt Handlungsempfehlungen.","Floods, drought, landslides: RiskLab shows what could happen [premium]. How vulnerable is Austria if climate change continues to worsen? In the RiskLab at Geosphere Austria, damage is assessed before it occurs - and recommendations for action are developed.","Flumina, siccitas, landslides: RiskLab ostendit quid fieri posset [premium]. Quomodo vulnerabilis est Austria, si mutatio climatis peior pergit? In RiskLab apud Geosphaeram Austriae damnum aestimatur antequam fiat - et commendationes actionis augentur.",https://www.diepresse.com/20757350/hochwasser-duerre-hangrutschungen-risklab-zeigt-was-passieren-koennte,https://img.diepresse.com/public/incoming/30nb1c-apaimg360800990hrjpg/alternates/DPR_SOCIAL_MAGAZIN/APAIMG_360800990.HR.jpg,,"Die Aussichten sind düster. Während die Erwärmung global bei etwa 1,4 Grad Celsius liegt, hat sie in Österreich im Vergleich zur vorindustriellen Zeit bereits rund 3,1 Grad erreicht ein Klima-Hotspot… [+7139 chars]",,2026-04-19 15:49:54+00:00,edo,Austria,WCE,Europe
0a1eef24b4bd575f0f774708b4c9fc55,2026-04-19T05:28:03Z,Thunderstorm,Gewitter baden,www.stern.de,de,0.7,"Wetterausblick: Frühlingspause: Wo Regen und Gewitter drohen. Gewitter im Wetterrucksack: Wer am Sonntag in Baden-Württemberg einen Ausflug machen möchte, braucht Geduld – und besser auch einen Regenschirm. Sonne gibt’s nur vereinzelt.",Wetterausblick: Frühlingspause: Wo Regen und Gewitter drohen,"Gewitter im Wetterrucksack: Wer am Sonntag in Baden-Württemberg einen Ausflug machen möchte, braucht Geduld – und besser auch einen Regenschirm. Sonne gibt’s nur vereinzelt.","Weather outlook: Spring break: Where there is a risk of rain and thunderstorms. Thunderstorm in your weather backpack: If you want to go on a trip in Baden-Württemberg on Sunday, you need patience - and better an umbrella. There is only occasional sun.","Tempestas prospectans: ver crepusculum: Ubi periculum est pluviae et tonitribus. Procella tempestatis in sacco dorsuali tuo: Si vis ire in itinere in Baden-Württemberg die Dominico, patientia debes - et umbella melior. Sol non est occasionatus.",https://www.stern.de/gesellschaft/regional/baden-wuerttemberg/wetterausblick--fruehlingspause--wo-regen-und-gewitter-drohen-37322340.html,https://image.stern.de/37322342/t/-x/v1/w1440/r1.7778/-/19--vycaqwcssyv8axs2048jpeg---a1384306ddb62fc8.jpg,,"Kopiere den aktuellen Link
Zur Merkliste hinzufügen
Gewitter im Wetterrucksack: Wer am Sonntag in Baden-Württemberg einen Ausflug machen möchte, braucht Geduld und besser auch einen Regenschirm. So… [+1746 chars]",,2026-04-20 07:22:15+00:00,wmo,Austria,WCE,Europe
f29214236ea94c58c3eff869dd256c5d,2026-04-18T06:31:55Z,Thunderstorm,Gewitter Deutschland,www.bild.de,de,0.8,Das schöne Wetter legt eine Pause ein - Regenwalze macht ganz Deutschland nass. Am Wochenende ist vorübergehend Schluss mit dem schönen Frühlingswetter. Aus nordwestlicher Richtung naht ein Regengebiet mit Gewitterpotenzial.,Das schöne Wetter legt eine Pause ein - Regenwalze macht ganz Deutschland nass,Am Wochenende ist vorübergehend Schluss mit dem schönen Frühlingswetter. Aus nordwestlicher Richtung naht ein Regengebiet mit Gewitterpotenzial.,The beautiful weather is taking a break - rain rollers are making all of Germany wet. This weekend the beautiful spring weather will temporarily end. A rainy area with thunderstorm potential is approaching from the northwest.,Tempestas pulchra intermissum est - pluviae scutulis omnia Germania uda sunt. Haec volutpat pulchra ver tempestas erit tempus finem. Area pluviosa cum tonitribus potentialibus ab aquilone adpropinquat.,https://www.bild.de/news/wetter/schoenes-wetter-legt-pause-ein-regenwalze-macht-deutschland-nass-69e2305a7c6e5e236a269ef5,"https://images.bild.de/69e2305a7c6e5e236a269ef5/4a00a247098b954e689110dfa4d293de,ed4131b5?w=1280",,"TTS-Player überspringenArtikel weiterlesenBerlin Am Wochenende ist vorübergehend Schluss mit dem schönen Frühlingswetter. Aus nordwestlicher Richtung naht ein Regengebiet, das sogar Gewitterpotenzial… [+3320 chars]",,2026-04-20 07:22:15+00:00,wmo,Germany,WCE,Europe
d38b92b81c4e48a504fc74609e616b52,2026-04-18T12:45:03Z,Thunderstorm,Gewitter Deutschland,www.bild.de,de,0.8,Das schöne Wetter legt eine Pause ein - Regenwalze kommt auf Deutschland zu. Aus nordwestlicher Richtung naht ein Regengebiet mit Gewitterpotenzial. Noch am Samstag wird es regnen.,Das schöne Wetter legt eine Pause ein - Regenwalze kommt auf Deutschland zu,Aus nordwestlicher Richtung naht ein Regengebiet mit Gewitterpotenzial. Noch am Samstag wird es regnen.,The beautiful weather is taking a break - a rainstorm is approaching Germany. A rainy area with thunderstorm potential is approaching from the northwest. It will still rain on Saturday.,Tempestas pulchra intermissum est - nimbus Germaniae appropinquat. Area pluviosa cum tonitribus potentialibus ab aquilone adpropinquat. Hoc die Saturni adhuc pluet.,https://www.bild.de/news/wetter/regenwalze-kommt-auf-deutschland-zu-schoenes-wetter-legt-pause-ein-69e2305a7c6e5e236a269ef5,"https://images.bild.de/69e2305a7c6e5e236a269ef5/4a00a247098b954e689110dfa4d293de,ed4131b5?w=1280",,"TTS-Player überspringenArtikel weiterlesenBerlin Am Wochenende ist vorübergehend Schluss mit dem schönen Frühlingswetter. Aus nordwestlicher Richtung naht ein Regengebiet, das sogar Gewitterpotenzial… [+3320 chars]",,2026-04-20 07:22:15+00:00,wmo,Germany,WCE,Europe
8da40af2e3d6b9c0a5fab9dc1050536d,2026-04-02T04:00:00Z,Storm,Sturm Voitsberg,www.focus.de,de,0.1,"Anpiksen und Abschrecken von Eiern ist ""gar nicht nötig"". Eier gehören zum bevorstehenden Osterfest dazu wie der Osterhase und Schokolade. Wie die Verbraucherzentrale nun erklärt, halten sich bei der Zubereitung von Eiern jedoch hartnäckig einige Irrtümer.","Anpiksen und Abschrecken von Eiern ist ""gar nicht nötig""","Eier gehören zum bevorstehenden Osterfest dazu wie der Osterhase und Schokolade. Wie die Verbraucherzentrale nun erklärt, halten sich bei der Zubereitung von Eiern jedoch hartnäckig einige Irrtümer.","Pricking and quenching eggs is “not necessary at all”. Eggs are as much a part of the upcoming Easter celebration as the Easter bunny and chocolate. However, as the consumer advice center now explains, there are still some persistent mistakes when preparing eggs.","Ova pungere et exstinguere non est omnino necessarium. Ova tantum sunt pars celebrationis venturae Paschae, quantum egestas paschalis et scelerisque. Sed, ut nunc medium consilium dolor ex- plicatur, adhuc sunt quaedam errata pertinacia, cum ova parant.",https://www.focus.de/gesundheit/ernaehrung/anpiksen-und-abschrecken-von-eiern-ist-gar-nicht-noetig_5131370a-9656-45e3-bc5c-8be0f5482a2c.html,"https://quadro.burda-forward.de/ctf/3a222052-de2f-4b54-be0a-73eb1e974b09.477bbe73-63e4-4cf7-a9d9-30d2563fd5ef.jpg?im=RegionOfInterestCrop=(1200,630),regionOfInterest=(1178,794)&hash=045556fe117672f60504d7a008db23eae331abc4dc100f63fafddf4183e8d99a",,"Konnten Generationen von Hausfrauen oder -männern irren? Damit das Ei nicht platzt, haben sie es vor dem Kochen angepiekst. Schließlich gibt es dafür ja sogar extra ein kleines Gerät. Stellt man das … [+2681 chars]",,2026-04-22 21:06:06+00:00,wmo,Austria,WCE,Europe
1ac03e6b653d531e7680daf69bac6a60,2026-04-16T15:21:25Z,Snow&Ice,Eis weiz,www.nzz.ch,de,0.1,"Wohnungsnot in der Schweiz und Verschärfung der Lex Koller: «Der Bericht des Bundesrats ist eine Frechheit», sagt der Raiffeisen-Chefökonom. Als Reaktion auf die 10-Millionen-Initiative der SVP will der Bundesrat es Ausländern erschweren, in der Schweiz Immobilien zu kaufen. Raiffeisen-Chefökonom Fredy Hasenmaile kritisiert die Vorlage.","Wohnungsnot in der Schweiz und Verschärfung der Lex Koller: «Der Bericht des Bundesrats ist eine Frechheit», sagt der Raiffeisen-Chefökonom","Als Reaktion auf die 10-Millionen-Initiative der SVP will der Bundesrat es Ausländern erschweren, in der Schweiz Immobilien zu kaufen. Raiffeisen-Chefökonom Fredy Hasenmaile kritisiert die Vorlage.","Housing shortage in Switzerland and worsening of the Lex Koller: “The Federal Council’s report is an outrage,” says the Raiffeisen chief economist. In response to the SVP's 10 million euro initiative, the Federal Council wants to make it more difficult for foreigners to buy real estate in Switzerland. Raiffeisen chief economist Fredy Hasenmaile criticizes the proposal.","In Helvetia commoratio et Lex Koller peioratio: ""Iniuria est nuntius Consilii Foederalis"", ait Raiffeisen summus oeconomus. In responsione SVP X miliones euronum inceptis, Consilium Foederatum difficiliorem reddere vult pro peregrinis realem praedium in Helvetia emere. Princeps oeconomus Raiffeisen Fredy Hasenmaile propositum reprehendit.",https://www.nzz.ch/wirtschaft/wohnungsnot-in-der-schweiz-warum-die-verschaerfung-der-lex-koller-nicht-hilft-ld.1933961,"https://img.nzz.ch/2026/04/16/2de8a401-66c4-40f6-b306-1b971c69c930.jpg?width=1200&height=675&fit=bounds&quality=75&auto=webp&crop=5068,2851,x0,y264&wmark=nzz",,"Als Reaktion auf die 10-Millionen-Initiative der SVP will der Bundesrat es Ausländern erschweren, in der Schweiz Immobilien zu kaufen. Der Raiffeisen-Chefökonom Fredy Hasenmaile kritisiert die Vorlag… [+7003 chars]",,2026-04-24 03:42:03+00:00,wmo,Austria,WCE,Europe
1d300a5a2a768e56f3558a2fbb8551e0,2026-04-14T03:56:16Z,Precipitation,Regen Deutschland,www.bild.de,de,0.8,"Wettergrenze am Dienstag - Sonnenschein teilt Deutschland in zwei Hälften. Am Dienstag ist das Wetter in Deutschland zweigeteilt. Auf der einen Seite Sonne, auf der anderen Seite Wolken und Regen.",Wettergrenze am Dienstag - Sonnenschein teilt Deutschland in zwei Hälften,"Am Dienstag ist das Wetter in Deutschland zweigeteilt. Auf der einen Seite Sonne, auf der anderen Seite Wolken und Regen.","Weather limit on Tuesday - sunshine divides Germany in half. On Tuesday the weather in Germany is divided into two parts. Sun on one side, clouds and rain on the other.","Tempestas terminus die Martis - iubar Germaniam in medium dividit. Die Martis tempestas in Germania in duas partes divisa est. Hinc Sol, hinc nubes, hinc pluvia.",https://www.bild.de/news/wetter/wettergrenze-am-dienstag-sonnenschein-teilt-deutschland-in-zwei-haelften-69dca8135be318f759f0b566,"https://images.bild.de/69dca8135be318f759f0b566/1ac4bb64bce8bf8abfb7d7a2050b710a,39e96197?w=1280",http://web.archive.org/web/20260415040949/https://www.bild.de/news/wetter/wettergrenze-am-dienstag-sonnenschein-teilt-deutschland-in-zwei-haelften-69dca8135be318f759f0b566,"TTS-Player überspringenArtikel weiterlesenWir hatten schon so schöne Frühlingstage. Doch aktuell zeigt sich das Wetter vielerorts von seiner tristen Seite: grauer Himmel, unangenehm kalter Wind und i… [+2744 chars]",,2026-04-24 03:42:03+00:00,wmo,Germany,WCE,Europe
896960e187881524ea0e5d0acd9f97f7,2026-04-22T09:33:15Z,Precipitation,Regen Deutschland,www.n-tv.de,de,0.8,"Im Mai droht Frost: Hoch ""Uli"" verschafft uns sonnige Frühlingstage. Nach einem Regen-Intermezzo bringt der Frühling viele Sonnenstunden nach Deutschland. Erst am Wochenende drohen wechselhaftere Aussichten. Nachts verschafft der wolkenarme Himmel bis dahin beste Voraussetzungen für ein Himmelsspektakel.","Im Mai droht Frost: Hoch ""Uli"" verschafft uns sonnige Frühlingstage",Nach einem Regen-Intermezzo bringt der Frühling viele Sonnenstunden nach Deutschland. Erst am Wochenende drohen wechselhaftere Aussichten. Nachts verschafft der wolkenarme Himmel bis dahin beste Voraussetzungen für ein Himmelsspektakel.,"Frost threatens in May: Hoch “Uli” gives us sunny spring days. After an interlude of rain, spring brings many hours of sunshine to Germany. Only at the weekend will there be a risk of more changeable prospects. At night, the cloudless sky provides the best conditions for a celestial spectacle.","Pruina in mense Maio minatur: Hoch ""Uli"" nobis ver serenum dat dies. Post interludium pluviae ver multas horas in Germaniam apricum affert. Tantum in volutpat vestibulum periculum exspectationum mutabilium erit. Noctu sereno caelo optimas condiciones caelesti spectaculo praebet.",https://www.n-tv.de/panorama/Hoch-Uli-verschafft-uns-sonnige-Fruehlingstage-id30741859.html,https://www.n-tv.de/img/30741826/1776855468/Img_16_9/1200/Loewenzahn-blueht-am-Hohen-Peissenberg-vor-der-Kulisse-der-Alpen.jpg,http://web.archive.org/web/20260423021036/https://www.n-tv.de/panorama/Hoch-Uli-verschafft-uns-sonnige-Fruehlingstage-id30741859.html,"Löwenzahn blüht am Hohen Peißenberg vor der Kulisse der Alpen. (Foto: picture alliance / Jan Eifert)
Nach einem Regen-Intermezzo bringt der Frühling viele Sonnenstunden nach Deutschland. Erst am Woc… [+3203 chars]",,2026-04-24 03:42:03+00:00,wmo,Germany,WCE,Europe
4cae58c68de3540af12bc59aa4073564,2026-04-10T08:55:14Z,Storm,Sturm Österreich,sport.orf.at,de,0.1,"Tagger und Potapova erobern Linz im Sturm. Rechtzeitig zum 35-jährigen Jubiläum der Upper Austria Ladies in Linz sind Österreichs Spielerinnen mittendrin, statt nur dabei im Kampf um den Titel. Am Freitag (16.15 Uhr, live in ORF1) stehen mit Jungstar Lilli Tagger und Neoösterreicherin Anastasia Potapo…",Tagger und Potapova erobern Linz im Sturm,"Rechtzeitig zum 35-jährigen Jubiläum der Upper Austria Ladies in Linz sind Österreichs Spielerinnen mittendrin, statt nur dabei im Kampf um den Titel. Am Freitag (16.15 Uhr, live in ORF1) stehen mit Jungstar Lilli Tagger und Neoösterreicherin Anastasia Potapo…","Tagger and Potapova take Linz by storm. Just in time for the 35th anniversary of the Upper Austria Ladies in Linz, Austria's players are in the middle of it all, rather than just in the fight for the title. On Friday (4:15 p.m., live on ORF1) young star Lilli Tagger and neo-Austrian Anastasia Potapo…","Tagger et Potapova Reverendissimum vi capiunt. Nuper tempore 35 anniversario Superioris Austriae Dominarum in Linz, in medio eius omnes scaenicorum Austriae sunt, potius quam in pugna pro titulo. Die Veneris (4, 15 a.m., in ORF1 habito) stella iuvenis Lilli Tagger et Anastasia Potapo neo-austriana.",https://sport.orf.at/stories/3154600/,https://ibs.orf.at/sport?image=https%3A%2F%2Fassets.orf.at%2Fmims%2F2026%2F15%2F11%2Fcrops%2Fw%3D1200%2Ch%3D630%2Cq%3D75%2F2998378_master_1159611_tennis_linz_vor_viertelfinale_tagger_potapova_g.jpg%3Fs%3Daee9c295001e7abbe696c7ec3274933122b3dee1,,"Es ist unglaublich und einfach schön, dass hier in Österreich zwei Österreicherinnen im Viertelfinale spielen, ich bin sehr stolz auf uns, sprach Potapova wohl allen österreichischen Tennisfans aus d… [+5569 chars]",,2026-04-24 21:01:18+00:00,wmo,Austria,WCE,Europe
f31f09a33a0c20947a1ff4b69c500ecb,2026-04-11T14:00:48Z,Storm,Sturm Österreich,www.diepresse.com,de,0.1,"Sturm-Geschäftsführer Michael Parensen: „Dass in Österreich kein hoher europäischer Standard mehr vorherrscht, ist Fakt“ [premium]. Michael Parensen, Geschäftsführer Sport bei Tabellenführer Sturm, spricht über sein ramponiertes Standing bei den Fans, den Kampf um die größten Talente des Landes, die Grazer Abkehr vom Pressing-Fußball – und das desaströse Bild, das Österreichs Mannschaften…","Sturm-Geschäftsführer Michael Parensen: „Dass in Österreich kein hoher europäischer Standard mehr vorherrscht, ist Fakt“ [premium]","Michael Parensen, Geschäftsführer Sport bei Tabellenführer Sturm, spricht über sein ramponiertes Standing bei den Fans, den Kampf um die größten Talente des Landes, die Grazer Abkehr vom Pressing-Fußball – und das desaströse Bild, das Österreichs Mannschaften…","Sturm managing director Michael Parensen: “It is a fact that high European standards no longer prevail in Austria” [premium]. Michael Parensen, sports director at league leaders Sturm, talks about his battered standing with the fans, the fight for the country's greatest talents, Graz's move away from pressing football - and the disastrous picture that Austria's teams...","Michael Parensen Sturmius moderatorem administrandi: ""Respondet alta signa Europaea in Austria non diutius valere"". Michael Parensen, director lusus in foedere ducum Sturmorum, loquitur de stantem pulsatum cum alitonibus, pugna pro maximis patriae ingeniis, a Graz eu premente recedunt - et pictura calamitosa, quae iunctiones Austriae sunt...",https://www.diepresse.com/20753514/sturm-geschaeftsfuehrer-michael-parensen-dass-in-oesterreich-kein-hoher,https://img.diepresse.com/public/incoming/h5jcv7-gepa-20260320-101-143-0010/alternates/DPR_SOCIAL_MAGAZIN/GEPA-20260320-101-143-0010,,"Michael Parensen: Sich selbst zu benoten, ist immer schwierig. Mit einem Gut wäre ich schon einverstanden. Ich bin durchaus zufrieden. Wir konnten die sehr erfolgreiche Zeit fortsetzen und haben glei… [+8945 chars]",,2026-04-24 21:01:18+00:00,wmo,Austria,WCE,Europe
20e8fdf6c15c49aa9c6361f328bd309e,2026-04-17T03:38:25Z,Storm,Sturm Österreich,www.diepresse.com,de,0.1,"„Bürokratiekeule, die massiven Mehraufwand bringt“: WKÖ läuft Sturm gegen Lohntransparenz-Pläne [premium]. Österreich kommt bei den Verhandlungen zur Entgelttransparenz nicht recht weiter. Der „Presse“ erklärt die Arbeitgeberseite nun ausführlich ihre Vorbehalte und rechnet vor. Eine „Übererfüllung des Bürokratiepakets“ müsse unbedingt verhindert werden, heißt es.","„Bürokratiekeule, die massiven Mehraufwand bringt“: WKÖ läuft Sturm gegen Lohntransparenz-Pläne [premium]","Österreich kommt bei den Verhandlungen zur Entgelttransparenz nicht recht weiter. Der „Presse“ erklärt die Arbeitgeberseite nun ausführlich ihre Vorbehalte und rechnet vor. Eine „Übererfüllung des Bürokratiepakets“ müsse unbedingt verhindert werden, heißt es.",“Bureaucratic club that brings massive additional effort”: WKÖ is storming against wage transparency plans [premium]. Austria is not making much progress in the negotiations on pay transparency. The employers now explain their reservations to the “Presse” in detail and do the calculations. It is said that “overfulfillment of the bureaucratic package” must be prevented at all costs.,"""Bura grapheocraticum qui ingens conatus additicium fert"": WKÖ expugnat contra consilia pellucidae merces [premium]. Austria non multum proficit in tractatu de mercede perspicuitatis. Praefecti nunc suas exceptiones ""Presse"" explicant in singillatim et calculas faciunt. Dicitur ""expeditionem sarcinae officialis"" omnibus modis impediendam esse.",https://www.diepresse.com/20772475/buerokratiekeule-die-massiven-mehraufwand-bringt-wkoe-laeuft-sturm,https://img.diepresse.com/public/incoming/g115it-417924236jpg/alternates/DPR_SOCIAL_NACHRICHTEN/417924236.jpg,,"Eigentlich ist die Sache klar: Bis spätestens 7. Juni muss die EU-Lohntransparenzlinie im nationalen Recht verankert sein, sonst droht Österreich wie auch anderen Mitgliedstaaten, die sich bei der Um… [+4123 chars]",,2026-04-24 21:01:18+00:00,wmo,Austria,WCE,Europe
55f5ec36ce580a7c9c33e5573548be22,2026-04-01T10:48:24Z,Drought,Regenmangel Österreich,www.tagesspiegel.de,de,0.3,Wettervorhersage: Ostern wird leicht unbeständig – Sonne vor allem am Montag. Zu Ostern wird es deutlich milder in Deutschland. Vor allem am Montag soll es viel Sonne geben. Doch am Sonntag kann es zwischenzeitlich mancherorts ungemütlich werden.,Wettervorhersage: Ostern wird leicht unbeständig – Sonne vor allem am Montag,Zu Ostern wird es deutlich milder in Deutschland. Vor allem am Montag soll es viel Sonne geben. Doch am Sonntag kann es zwischenzeitlich mancherorts ungemütlich werden.,"Weather forecast: Easter will be slightly unsettled - sunshine especially on Monday. It will be significantly milder in Germany at Easter. There should be a lot of sun, especially on Monday. But on Sunday it can get uncomfortable in some places.","Tempestas praenuntietur: Paschae leviter commotum erit - praesertim die Lunae iubar. Signanter lenior in Germania in Pascha erit. Multum solis esse debet, praesertim die Lunae. Sed die Dominico alicubi incommoda accipere potest.",https://www.tagesspiegel.de/gesellschaft/panorama/wettervorhersage-ostern-wird-leicht-unbestandig--sonne-vor-allem-am-montag-15424350.html,https://www.tagesspiegel.de/images/15424349/alternates/BASE_16_9_W1400/1775040504000/osterbrunnen-im-kloster-maulbronn.jpeg,,"Das Wetter zu Ostern wird leicht unbeständig und teils windig, aber deutlich milder. Am Sonntag kann es nach aktuellem Stand im Norden Schauer und im Süden vereinzelte Gewitter geben, für Ostermontag… [+2832 chars]",,2026-04-25 03:26:35+00:00,edo,Austria,WCE,Europe
