index,published,topic,term,domain,language,valid,de,title,description,en,la,url,image,archive,content,quote,added,feed,country,ipcc,continent
3dfe370b8194698497abe34eaa02ec52,2026-03-02T10:46:27Z,Snow&Ice,Schnee Oberwart,burgenland.orf.at,de,0.8,Störche kehren zurück. Im Burgenland sind die ersten Störche bereits gelandet. Im Bezirk Oberwart wurden im Februar bereits Vögel im Schnee gesichtet und auch Rust meldete die ersten Rückkehrer.,Störche kehren zurück,Im Burgenland sind die ersten Störche bereits gelandet. Im Bezirk Oberwart wurden im Februar bereits Vögel im Schnee gesichtet und auch Rust meldete die ersten Rückkehrer.,Storks return. The first storks have already landed in Burgenland. Birds were already spotted in the snow in the Oberwart district in February and Rust also reported the first returns.,Ciconiae reverti. Primum ciconiae iam in Burgenlandiam appulerunt. Volucres in regione Oberwart mense Februario et Rust etiam primos reditus nivibus maculatos iam nuntiaverunt.,https://burgenland.orf.at/stories/3344046/,https://ibs.orf.at/bgl?image=https%3A%2F%2Foekastatic.orf.at%2Fmims%2F2026%2F10%2F66%2Fcrops%2Fw%3D1200%2Ch%3D627%2Cq%3D75%2F2954413_master_1142166_burgenland_heute_wetter_aus_st._martin_in_der_wart_260223_strobl_00_00_42_00.jpg%3Fs%3Dbb8b8510d8eee241d7e5f8078fc879102064e9d7,,"Schon Mitte Februar, so früh wie noch nie, landete ein Storch in St. Martin in der Wart (Bezirk Oberwart). Er erlebte dann den Wintereinbruch und musste ein Wochenende lang mit Schnee klarkommen.
OR… [+620 chars]",,2026-03-07 05:46:14+00:00,wmo,Austria,WCE,Europe
8f1d5603fb689f2132872bee907f61c8,2026-03-04T11:58:00Z,Snow&Ice,Eis Belgien,www.focus.de,de,0.7,"Schockierte NRW-Autofahrer fluten belgische Tankstellen. Weil die Spritpreise in Deutschland explodieren, weichen Autofahrer aus NRW auf Tankstellen in Belgien aus. Dort lockt ein erheblicher Preisvorteil.",Schockierte NRW-Autofahrer fluten belgische Tankstellen,"Weil die Spritpreise in Deutschland explodieren, weichen Autofahrer aus NRW auf Tankstellen in Belgien aus. Dort lockt ein erheblicher Preisvorteil.","Shocked NRW drivers flood Belgian gas stations. Because fuel prices are exploding in Germany, drivers from North Rhine-Westphalia are turning to gas stations in Belgium. There is a significant price advantage there.","Exactores NRW inundationem gasorum Belgarum constituunt. Quia pretia escae in Germania explodunt, aurigae ab septentrione Rheno-Westphaliae ad stationes gasi in Belgium convertunt. Est commodo notabilis pretium.",https://www.focus.de/finanzen/haben-auch-nix-zu-verschenken-schockierte-nrw-autofahrer-fluten-belgische-tankstellen_a4309fcb-646f-4e74-9b6d-a33bc09b9288.html,https://quadro.burda-forward.de/ctf/6311068d-2963-472d-a322-efc30432848a.45f25c7a-da50-4d90-bc0f-56b6444d3bf9.jpeg?im=RegionOfInterestCrop%3D%281200%2C630%29%2CregionOfInterest%3D%282012%2C1322%29&hash=0085a4cfc14d092084b9b23436c76348e83ff04bbc0a06e5b8d989a7d61474a4,,"Wegen des Konflikts mit dem Iran sind die Kosten für Benzin und Diesel in Köln und Umgebung, wie auch im Rest von Deutschland, binnen kürzester Zeit explodiert.
Schon am Sonntag (1. März) hatte der … [+2988 chars]",,2026-03-08 15:34:39+00:00,wmo,Belgium,WCE,Europe
23eb411bf223d5eb80f1954af9815003,2026-03-02T14:28:30Z,Snow&Ice,Deutschland friert,www.faz.net,de,0.3,"Ausstellung „Alles vergessen“: „Plötzlich war ‚jüdisch‘ sehr negativ besetzt“. Sprich, Erinnerung, sprich: Das Jüdische Museum Wien beschäftigt sich in einer klugen Ausstellung mit dem Vergessen – und stemmt sich gleichzeitig gegen den Besucherschwund.",Ausstellung „Alles vergessen“: „Plötzlich war ‚jüdisch‘ sehr negativ besetzt“,"Sprich, Erinnerung, sprich: Das Jüdische Museum Wien beschäftigt sich in einer klugen Ausstellung mit dem Vergessen – und stemmt sich gleichzeitig gegen den Besucherschwund.","Exhibition “Forgotten Everything”: “Suddenly ‘Jewish’ had a very negative connotation.” In other words, remembrance: The Jewish Museum Vienna deals with forgetting in a clever exhibition - and at the same time combats the decline in visitors.","Exhibition ""Oblitus Omnia"": ""Subito 'Iudaeis valde negativam habuit connotationem"". Id est, recordatio: Museum Judaicum Vindobonense agit de immemores sollerti spectaculi, et simul in visitatores fre- quentes pugnat.",https://www.faz.net/aktuell/feuilleton/kunst-und-architektur/ausstellung/kampf-gegen-besucherschwund-alles-vergessen-im-juedischen-museum-wien-110845977.html,https://media0.faz.net/image/w1200h627/a20c8ab0f937/w1722h899x0y564o/032026/1.10845975/davongekommen-edith-kramer.webp,,"Das Misrachi-Haus in der Nordwestecke des Judenplatzes beherbergt das Museum Judenplatz, eine Zweigstelle des Jüdischen Museums in der Dorotheergasse. Der Eingang liegt etwas versteckt hinter dem Kub… [+7158 chars]",,2026-03-09 16:07:31+00:00,wmo,Germany,WCE,Europe
fac5108ad5d9c800bb3433f9daee6961,2026-03-05T18:45:51Z,Precipitation,Niederschlag Deutschland,www.bild.de,de,0.3,Tausende Tonnen Partikel - Riesige Sahara-Staubwolke dieselt Deutschland ein. Rötliche Schwaden sind in der Luft. Saharastaub macht sich am Himmel breit. Und es wird noch mehr.,Tausende Tonnen Partikel - Riesige Sahara-Staubwolke dieselt Deutschland ein,Rötliche Schwaden sind in der Luft. Saharastaub macht sich am Himmel breit. Und es wird noch mehr.,Thousands of tons of particles - Huge Sahara dust cloud is engulfing Germany. Reddish clouds are in the air. Saharan dust spreads across the sky. And there will be more.,Millia talentorum particularum - Sahara ingens pulvis nubis Germaniae obvolvitur. Nubes rubrae in aere sunt. Saharan pulvis per caelum spargit. Et plura erunt.,https://www.bild.de/news/wetter/riesige-sahara-staubwolke-dieselt-deutschland-ein-tausende-tonnen-partikel-69a807b1563ae9c42dea3e7f,"https://images.bild.de/69a807b1563ae9c42dea3e7f/d95bf178b80af9dc002f269b95864c25,3c300b8f?w=1280",,TTS-Player überspringenArtikel weiterlesenBerlin Hoch Jannis gibt am Donnerstag wieder alles und sorgt mit neuer Wärme für Gute-Laune-Feeling. Wenn nur der rötliche Staub nicht in der Atmosphäre wäre… [+3983 chars],,2026-03-09 16:07:31+00:00,wmo,Germany,WCE,Europe
02b869b212b58614f944af699a9b9a0b,2026-03-06T03:51:20Z,Thunderstorm,Hagel Italien,www.bild.de,de,0.3,"Ein Freitag zum Freuen - Sonnen-Aufschlag mit bis zu 21 Grad Celsius. Die Sonne baggert um unsere Aufmerksamkeit. Nichts wie raus, das Wetter ruft! Doch Sand gibt es nicht nur auf dem Volleyballfeld, sondern auch in der Luft.",Ein Freitag zum Freuen - Sonnen-Aufschlag mit bis zu 21 Grad Celsius,"Die Sonne baggert um unsere Aufmerksamkeit. Nichts wie raus, das Wetter ruft! Doch Sand gibt es nicht nur auf dem Volleyballfeld, sondern auch in der Luft.","A Friday to look forward to - sunshine with temperatures up to 21 degrees Celsius. The sun is vying for our attention. Let's get out, the weather is calling! But there is sand not only on the volleyball court, but also in the air.","A Veneris ut exspecto - sole cum temperaturis usque ad 21 gradus Celsius. Sol certat operam nostram. Eamus, vocat tempestas! Sed non nisi in est pulvinar vestibulum sed et arcu.",https://www.bild.de/news/wetter/sonnen-aufschlag-mit-bis-zu-21-grad-ein-freitag-zum-freuen-69a9593c3d4c79b00798431b,"https://images.bild.de/69a9593c3d4c79b00798431b/b94bda296111faf5ce0173b4e2f2c5a5,d53ad65c?w=1280",,TTS-Player überspringenArtikel weiterlesenBerlin Trotz des Saharastaubs und vielerorts noch klirrend kalter Nächte bekommt Deutschland kurz vor dem Wochenende ein ausgiebiges Sonnenbad. Wir werden mi… [+3687 chars],,2026-03-09 16:07:31+00:00,wmo,Italy,MED,Europe
cf40a68de1a2865ffda00cde4ed74780,2026-03-07T03:00:13Z,Snow&Ice,Schnee Sarnen Lungern,www.zeit.de,de,0.3,Naturphänomene: Afrika-Gruß: Warum der Himmel grau ist und die Sonne milchig. Hier finden Sie Informationen zu dem Thema „Naturphänomene“. Lesen Sie jetzt „Afrika-Gruß: Warum der Himmel grau ist und die Sonne milchig“.,Naturphänomene: Afrika-Gruß: Warum der Himmel grau ist und die Sonne milchig,Hier finden Sie Informationen zu dem Thema „Naturphänomene“. Lesen Sie jetzt „Afrika-Gruß: Warum der Himmel grau ist und die Sonne milchig“.,Natural phenomena: Greetings from Africa: Why the sky is gray and the sun is milky. Here you will find information on the topic of “natural phenomena”. Read “Greetings to Africa: Why the sky is gray and the sun is milky” now.,"Phaenomena naturalia: Salvete ex Africa: Caelum canit et sol lacteum est. Hic informationes invenies in argumento ""phaenomenorum naturalium"". Lege ""Salvete Africam: Quare caelum cinereum est et sol lacteus"" nunc est.",https://www.zeit.de/news/2026-03/07/afrika-gruss-warum-der-himmel-grau-ist-und-die-sonne-milchig,https://img.zeit.de/news/2026-03/07/afrika-gruss-warum-der-himmel-grau-ist-und-die-sonne-milchig-image-group/wide__1300x731,,"Ein grauer Schleier liegt in diesen Tagen über Baden-Württemberg, doch dieses Mal ist es keine Wolke und auch kein Nebel. Es ist die Sahara, aus der quasi per Luftpost Millionen Tonnen Wüstenstaub bi… [+4234 chars]",,2026-03-09 16:07:31+00:00,wmo,Switzerland,WCE,Europe
d55368a498dda56fb294b935d08125dd,2026-03-07T06:01:20Z,Snow&Ice,Frost Steyrland,www.zeit.de,de,0.3,DWD-Vorhersage: Bis zu 20 Grad und Saharastaub im Land. Hier finden Sie Informationen zu dem Thema „DWD-Vorhersage“. Lesen Sie jetzt „Bis zu 20 Grad und Saharastaub im Land“.,DWD-Vorhersage: Bis zu 20 Grad und Saharastaub im Land,Hier finden Sie Informationen zu dem Thema „DWD-Vorhersage“. Lesen Sie jetzt „Bis zu 20 Grad und Saharastaub im Land“.,DWD forecast: Up to 20 degrees and Sahara dust in the country. Here you will find information on the topic of “DWD forecast”. Now read “Up to 20 degrees and Sahara dust in the country”.,"Providemus DWD: Usque ad 20 gradus et pulvis Saharae in regione. Hic informationes invenies in argumento ""DWD praecognoscendi"". Nunc lege ""usque ad XX gradus et Sahara pulvis in regione"".",https://www.zeit.de/news/2026-03/07/bis-zu-20-grad-und-saharastaub-im-land,https://img.zeit.de/news/2026-03/07/bis-zu-20-grad-und-saharastaub-im-land-image-group/wide__1300x731,,Die Sonnenbrille sollte man in Baden-Württemberg an diesem Wochenende am besten dabeihaben. Laut der Vorhersage des Deutschen Wetterdienstes (DWD) könnten die Temperaturen an diesem Wochenende die 20… [+1165 chars],,2026-03-09 16:07:31+00:00,wmo,Austria,WCE,Europe
2cb2d6ed2b8e2e3c0fa0f0b3796fc179,2026-03-07T07:22:37Z,Snow&Ice,Frost Steyrland,www.faz.net,de,0.3,"Nichts wie raus!: Blühende Landschaften. Winter ade! Drei Landschaftsfotografen verraten, wo der Frühling in Deutschland und Europa besonders fotogen ist.",Nichts wie raus!: Blühende Landschaften,"Winter ade! Drei Landschaftsfotografen verraten, wo der Frühling in Deutschland und Europa besonders fotogen ist.",Let's get out!: Blooming landscapes. Goodbye winter! Three landscape photographers reveal where spring is particularly photogenic in Germany and Europe.,Exi!: landscapes. Hieme vale! Tres toparchiae photographatae demonstrant ubi fons est praesertim photogenicus in Germania et Europa.,https://www.faz.net/aktuell/reise/wo-der-fruehling-besonders-fotogen-ist-accg-110848175.html,https://media0.faz.net/image/w1200h627/1fbed0c069a5/w3000h1567x0y301o/032026/1.10848173/die-tage-werden-waermer.webp,,"Deutschland: Nationalpark Hainich
Seinen alten Buchenwäldern hat der Nationalpark Hainich in Thüringen den Weltnaturerbestatus zu verdanken, doch die heimlichen Stars im Wald sind die Frühblüher, di… [+6659 chars]",,2026-03-09 16:07:31+00:00,wmo,Austria,WCE,Europe
1a0f86356d9006232bd9d2df2d70cf4c,2026-03-07T13:03:55Z,Snow&Ice,gefrierender Linthebene Gaster,www.tagesspiegel.de,de,0.3,"Warmes Wetter, aber schlechte Luft: Saharastaub trübt den Himmel über Deutschland. Menschen mit Asthma sollten sich nicht zu lange im Freien aufhalten. Auch von exzessivem Sport wird abgeraten – der wäre schlecht für die Lunge.","Warmes Wetter, aber schlechte Luft: Saharastaub trübt den Himmel über Deutschland",Menschen mit Asthma sollten sich nicht zu lange im Freien aufhalten. Auch von exzessivem Sport wird abgeraten – der wäre schlecht für die Lunge.,"Warm weather, but bad air: Sahara dust clouds the sky over Germany. People with asthma should not spend too long outside. Excessive exercise is also not recommended - it would be bad for the lungs.","Tempestas tepida, sed malus aer: Sahara pulvis nubit caelum per Germaniam. Populus cum suspirio nimium diu foris immorari non debet. Exercitatio nimia non commendatur - malum pulmoni.",https://www.tagesspiegel.de/gesellschaft/panorama/warmes-wetter-aber-schlechte-luft-saharastaub-trubt-den-himmel-uber-deutschland-15328335.html,https://www.tagesspiegel.de/images/15328529/alternates/BASE_16_9_W1400/1772888512000/saharastaub-trube-sonne-am-grauen-himmel.jpeg,,Es ist herrlich warm am Wochenende - aber auch trüb. Hoch Konrad hängt weiterhin über Deutschland und bringt derzeit Temperaturen zwischen 14 und 19 Grad. Örtlich wird wohl auch die 20 Grad-Marke err… [+1574 chars],,2026-03-09 16:07:31+00:00,wmo,Switzerland,WCE,Europe
6280220f920832f8f39f28937ca071c0,2026-03-08T14:23:04Z,Thunderstorm,Gewitter Deutschland,www.n-tv.de,de,0.8,"Wetterwoche im Schnellcheck: Frühlingswetter setzt sich weiter durch - nur vereinzelt Schauer. In Deutschland bleibt es für die Jahreszeit überdurchschnittlich warm, vielerorts klettern die Temperaturen bis an die 19-Grad-Marke. Erst Mitte der Woche ziehen die Hochdruckzonen ""Konrad"" und ""Jannis"" ab - dann kann es zu Schauern und Gewitter kommen.",Wetterwoche im Schnellcheck: Frühlingswetter setzt sich weiter durch - nur vereinzelt Schauer,"In Deutschland bleibt es für die Jahreszeit überdurchschnittlich warm, vielerorts klettern die Temperaturen bis an die 19-Grad-Marke. Erst Mitte der Woche ziehen die Hochdruckzonen ""Konrad"" und ""Jannis"" ab - dann kann es zu Schauern und Gewitter kommen.","Weather week in quick check: Spring weather continues to prevail - only a few showers. In Germany it remains warmer than average for the time of year, with temperatures climbing to the 19 degree mark in many places. The high pressure zones “Konrad” and “Jannis” will not move away until the middle of the week - then showers and thunderstorms can occur.","Tempestas septimana in velox reprehendo: Ver tempestas pergit vincere - pauci imbres. In Germania calidior quam mediocris pro tempore anni manet, cum temperaturis ad 19 gradum notae multis in locis ascendentibus. Zonae pressurae altae ""Konrad"" et ""Jannis"" non se movebunt nisi ad mediam hebdomadem - tunc imbres et tonitrua fieri possunt.",https://www.n-tv.de/panorama/Fruehlingswetter-setzt-sich-weiter-durch-nur-vereinzelt-Schauer-id30444460.html,https://www.n-tv.de/img/30444524/1772976030/Img_16_9/1200/Narzissen-bluehen-bei-fruehlingshaften-Temperaturen-im-Stadtwald.jpg,,"Narzissen zeigen sich bei frühlingshaften Temperaturen. (Foto: picture alliance/dpa)
In Deutschland bleibt es für die Jahreszeit überdurchschnittlich warm, vielerorts klettern die Temperaturen bis a… [+4961 chars]",,2026-03-09 20:47:08+00:00,wmo,Germany,WCE,Europe
da398eec791cbc65dd558f28b2924b73,2026-03-04T17:00:37Z,Snow&Ice,Eis Neunkirchen,www.n-tv.de,de,0.3,"""Ich schieße die meisten Tore"": VfB-Star Undav total genervt von DFB-Sturm-Debatte. In wenigen Monaten geht es für das DFB-Team zur Weltmeisterschaft. Mit an Bord des Fliegers will auch Deniz Undav sein. Der VfB-Stürmer kann die aktuellen Diskussionen um seine Person allerdings mal gar nicht nachvollziehen.","""Ich schieße die meisten Tore"": VfB-Star Undav total genervt von DFB-Sturm-Debatte",In wenigen Monaten geht es für das DFB-Team zur Weltmeisterschaft. Mit an Bord des Fliegers will auch Deniz Undav sein. Der VfB-Stürmer kann die aktuellen Diskussionen um seine Person allerdings mal gar nicht nachvollziehen.,"“I score the most goals”: ​​VfB star Undav totally annoyed by the DFB-Sturm debate. In a few months the DFB team will be going to the World Cup. Deniz Undav also wants to be on board the plane. However, the VfB striker cannot understand the current discussions about himself.","""Plurimas scorpios metas"": VfB stellam Undav a DFB-Sturm disputando prorsus angebatur. Paucis mensibus DFB manipulus in Trophaeum Mundi erit. Deniz Undav etiam planum in tabula esse vult. Nihilominus, VfB percussor non potest intelligere quaestiones de se praesentes.",https://www.n-tv.de/sport/fussball/VfB-Star-Undav-total-genervt-von-DFB-Sturm-Debatte-id30432002.html,https://www.n-tv.de/img/30431992/1772645917/Img_16_9/1200/Deniz-Undav-of-Germany-controls-the-ball-GES-Fussball-UEFA-Nations-League-Spiel-um-Platz-3-Deutschland-Frankreich-08-06.jpg,,"Wurde von Julian Nagelsmann zuletzt nicht mehr berücksichtigt. (Foto: picture alliance / GES/Marvin Ibo Güngör)
In wenigen Monaten geht es für das DFB-Team zur Weltmeisterschaft. Mit an Bord des Fli… [+1918 chars]",,2026-03-10 20:46:00+00:00,wmo,Austria,WCE,Europe
96735978b16cdb0f53cd7fb7b11bc707,2026-03-09T03:15:04Z,Snow&Ice,eiskalt Lauterbrunnen Wilderswil,www.stern.de,de,0.3,"Wird Stürmer unfair beurteilt?: DFB-Debatte: Matthäus würde Undav ""auf jeden Fall mitnehmen"". Deniz Undav fühlt sich als Kandidat für den deutschen WM-Sturm zu wenig wahrgenommen und macht sich zuletzt Luft. Jetzt erhält der VfB-Torjäger Rückendeckung von Rekordnationalspieler Lothar Matthäus.","Wird Stürmer unfair beurteilt?: DFB-Debatte: Matthäus würde Undav ""auf jeden Fall mitnehmen""",Deniz Undav fühlt sich als Kandidat für den deutschen WM-Sturm zu wenig wahrgenommen und macht sich zuletzt Luft. Jetzt erhält der VfB-Torjäger Rückendeckung von Rekordnationalspieler Lothar Matthäus.,Is the striker judged unfairly?: DFB debate: Matthäus would “definitely take Undav with him”. Deniz Undav feels that he is not being noticed enough as a candidate for the German World Cup team and has recently vented his thoughts. Now the VfB goalscorer has the support of record national player Lothar Matthäus.,Estne percussor iniuste iudicatus?: DFB disputatio: Matthäus «certe secum Undav sumet». Deniz Undav sentit se non satis animadversum esse pro candidato pro theatro Mundi Germanici et nuper cogitationes suas saevisse. Nunc VfB goalcorer suffragationem nationalis lusoris Lotharii Matthäus habet.,https://www.stern.de/gesellschaft/regional/baden-wuerttemberg/wird-stuermer-unfair-beurteilt---dfb-debatte--matthaeus-wuerde-undav--auf-jeden-fall-mitnehmen--37202940.html,https://image.stern.de/37202942/t/it/v1/w1440/r1.7778/-/09--ubo6afbxrcv6axs2048jpeg---8a2be15d74f40f88.jpg,,"Kopiere den aktuellen Link
Zur Merkliste hinzufügen
Deniz Undav fühlt sich als Kandidat für den deutschen WM-Sturm zu wenig wahrgenommen und macht sich zuletzt Luft. Jetzt erhält der VfB-Torjäger R… [+1584 chars]",,2026-03-10 20:46:00+00:00,wmo,Switzerland,WCE,Europe
74ff09bcfc7f918c86c30a47fae2038c,2026-03-09T03:16:41Z,Snow&Ice,Eis Sankt Johann im Pongau,www.tagesspiegel.de,de,0.3,Wird Stürmer unfair beurteilt?: DFB-Debatte: Matthäus würde Undav „auf jeden Fall mitnehmen“. Deniz Undav fühlt sich als Kandidat für den deutschen WM-Sturm zu wenig wahrgenommen und macht sich zuletzt Luft. Jetzt erhält der VfB-Torjäger Rückendeckung von Rekordnationalspieler Lothar Matthäus.,Wird Stürmer unfair beurteilt?: DFB-Debatte: Matthäus würde Undav „auf jeden Fall mitnehmen“,Deniz Undav fühlt sich als Kandidat für den deutschen WM-Sturm zu wenig wahrgenommen und macht sich zuletzt Luft. Jetzt erhält der VfB-Torjäger Rückendeckung von Rekordnationalspieler Lothar Matthäus.,Is the striker judged unfairly?: DFB debate: Matthäus would “definitely take Undav with him”. Deniz Undav feels that he is not being noticed enough as a candidate for the German World Cup team and has recently vented his thoughts. Now the VfB goalscorer has the support of record national player Lothar Matthäus.,Estne percussor iniuste iudicatus?: DFB disputatio: Matthäus «certe secum Undav sumet». Deniz Undav sentit se non satis animadversum esse pro candidato pro theatro Mundi Germanici et nuper cogitationes suas saevisse. Nunc VfB goalcorer suffragationem nationalis lusoris Lotharii Matthäus habet.,https://www.tagesspiegel.de/sport/wird-sturmer-unfair-beurteilt-dfb-debatte-matthaus-wurde-undav-auf-jeden-fall-mitnehmen-15331308.html,https://www.tagesspiegel.de/images/15331307/alternates/BASE_16_9_W1400/1773026201000/deniz-undav.jpeg,,"Vier Spiele, vier Tore - die Serie hält: Stuttgarts Stürmer Deniz Undav hat am Wochenende weitere Argumente für eine Rückkehr in die Nationalmannschaft gesammelt. Nach seinem nächsten Treffer für den… [+1414 chars]",,2026-03-10 20:46:00+00:00,wmo,Austria,WCE,Europe
e91325d2172edea8b1f8ed94b0b606e0,2026-03-05T16:48:15Z,Snow&Ice,Eis Deutschland,www.bild.de,de,0.7,"Undav vermisst Wertschätzung beim DFB - Rätsel um unseren besten Stürmer. Deniz Undav ist Deutschlands bester Stürmer, doch seine Leistungen bleiben unerkannt. Der Stuttgart-Star wünscht sich mehr Wertschätzung beim DFB.",Undav vermisst Wertschätzung beim DFB - Rätsel um unseren besten Stürmer,"Deniz Undav ist Deutschlands bester Stürmer, doch seine Leistungen bleiben unerkannt. Der Stuttgart-Star wünscht sich mehr Wertschätzung beim DFB.","Undav misses appreciation from the DFB - mystery about our best striker. Deniz Undav is Germany's best striker, but his achievements remain unrecognized. The Stuttgart star would like to see more appreciation from the DFB.","Undav appreciation from the DFB - mysterium noslra optimus percussor. Deniz Undav percussor optimus Germaniae est, sed res gestae eius ignoratae manent. Stella Stuttgart plus appretiatur ex DFB videre.",https://www.bild.de/sport/fussball/nationalmannschaft-raetsel-um-unseren-besten-dfbstuermer-deniz-undav-69a9a8102e3fa902a8cf81f3,"https://images.bild.de/69a9a8102e3fa902a8cf81f3/5c8a43fc41eb964d69902d69d8f9ed3b,2d8316b4?w=1280",,TTS-Player überspringenArtikel weiterlesenEr ist Deutschlands bester Stürmer nur honoriert wird das nicht. So wirkt es zumindest auf Deniz Undav (29). Der Stuttgart-Stürmer ist mit 14 Treffern hinter… [+1867 chars],,2026-03-10 20:46:00+00:00,wmo,Germany,WCE,Europe
a2f55cd2814053a1bbbbbf81aaf6e455,2026-03-03T12:24:00Z,Snow&Ice,Eis Deutschland,www.focus.de,de,0.7,"Gas- und Ölpreis explodieren – und wir sind schutzlos. Öl springt um 14 Prozent, Gas um mehr als 50 Prozent. Die Speicher sind nur zu einem Fünftel gefüllt. Der Krieg im Iran trifft Deutschland ins Mark. Wind und Sonne können uns nicht helfen.",Gas- und Ölpreis explodieren – und wir sind schutzlos,"Öl springt um 14 Prozent, Gas um mehr als 50 Prozent. Die Speicher sind nur zu einem Fünftel gefüllt. Der Krieg im Iran trifft Deutschland ins Mark. Wind und Sonne können uns nicht helfen.","Gas and oil prices are exploding - and we are defenseless. Oil jumps by 14 percent, gas by more than 50 percent. The storage tanks are only one-fifth full. The war in Iran hits Germany to the core. Wind and sun cannot help us.","Gas et oleum pretium explodunt - et inermes sumus. Oleum salit per 14 centesimas, gas plus quam 50 percent. Lacus tabulariorum quinta tantum plena sunt. Bellum in Irania Germaniam in mediam pervenit. Ventus et sol nos iuvare non possunt.",https://www.focus.de/finanzen/gas-und-oelpreis-explodieren-und-wir-sind-schutzlos_e78e78bf-7d72-485f-8ea1-20b17e5e85ed.html,https://quadro.burda-forward.de/ctf/809956ba-e601-4dab-8459-22aaaad0440f.43a2d44f-319e-4511-9857-4aca094f74a4.jpg?im=RegionOfInterestCrop%3D%281200%2C630%29%2CregionOfInterest%3D%281026%2C886%29&hash=a9ae7ff625dcd034b13866d5ebedc06bc156e419fd29f9cd62345c27b70449b4,,"Drei Tage haben gereicht, um die Illusion von Deutschland als autark werdendes Energiewende-Land zu zerbröseln wie altes Mauerwerk. Seit dem vergangenen Wochenende zeigt der Weltmarkt, wer am längere… [+6500 chars]",,2026-03-11 02:45:55+00:00,wmo,Germany,WCE,Europe
5411b78c1bf6e8efb8b71fb4627b7868,2026-03-01T13:32:22Z,Snow&Ice,Frost Deutschland,www.n-tv.de,de,0.7,"Wetterwoche im Schnellcheck: Die Tage werden frühlingshaft schön, die Nächte teils frostig. Die Frühlingsboten begleiten Deutschland auch durch die erste Märzwoche. Mit Temperaturen bis zu 18 Grad und viel Sonnenschein ist vom Winter nur noch wenig zu spüren. Nachts kann es jedoch noch ordentlich frisch werden.","Wetterwoche im Schnellcheck: Die Tage werden frühlingshaft schön, die Nächte teils frostig",Die Frühlingsboten begleiten Deutschland auch durch die erste Märzwoche. Mit Temperaturen bis zu 18 Grad und viel Sonnenschein ist vom Winter nur noch wenig zu spüren. Nachts kann es jedoch noch ordentlich frisch werden.,"Weather week in quick check: The days will be beautiful as spring, the nights will be frosty at times. The signs of spring also accompany Germany through the first week of March. With temperatures up to 18 degrees and lots of sunshine, there is little sign of winter left. However, it can still get quite chilly at night.","Tempestas septimana in velox reprehendo: Dies pulchri erunt sicut ver, noctes interdum gelu. Signa veris etiam Germaniam per primam septimanam Martii comitantur. Cum temperaturis usque ad 18 gradus et sortes solis, parum signum hiemis relictum est. Potest tamen adhuc nocte satis frigida.",https://www.n-tv.de/panorama/Die-Tage-werden-fruehlingshaft-schoen-die-Naechte-teils-frostig-id30418293.html,https://www.n-tv.de/img/30418243/1772368504/Img_16_9/1200/Bluehende-Krokusse-Crocus-im-Garten-im-Fruehling-an-einem-sonnigen-Tag-Bayern-Deutschland-Europa.jpg,,"Fast ist er da, der Frühling. (Foto: picture alliance / imageBROKER)
Die Frühlingsboten begleiten Deutschland auch durch die erste Märzwoche. Mit Temperaturen bis zu 18 Grad und viel Sonnenschein is… [+3627 chars]",,2026-03-12 10:54:19+00:00,wmo,Germany,WCE,Europe
