index,published,topic,term,domain,language,valid,de,title,description,en,la,url,image,archive,content,quote,added,feed,country,ipcc,continent
53b4a0f7456504bc91cd46ff3c17bdb6,2026-05-07T06:00:00Z,Snow&Ice,Frost Steckborn Müllheim,www.telepolis.de,de,0.3,"Erst Dürre, dann Frost: Warum der deutsche Frühling immer gefährlicher wird. Extremes Wetter im Frühling trifft Wälder, Felder und Ernten hart – und die Ursache dahinter ist komplexer als viele denken.","Erst Dürre, dann Frost: Warum der deutsche Frühling immer gefährlicher wird","Extremes Wetter im Frühling trifft Wälder, Felder und Ernten hart – und die Ursache dahinter ist komplexer als viele denken.","First drought, then frost: Why the German spring is becoming more and more dangerous. Extreme spring weather hits forests, fields and crops hard - and the cause is more complex than many think.","Primo siccitas, deinde pruina: quare in Germanicum ver magis ac periculosius est. Ver extrema tempestas silvas, agros et fruges duras - et causa multiplicior quam multi putant.",https://www.telepolis.de/article/Erst-Duerre-dann-Frost-Warum-der-deutsche-Fruehling-immer-gefaehrlicher-wird-11280675.html,https://heise.cloudimg.io/cdn/n/n/_www-heise-de_/imgs/18/5/0/7/5/7/3/0/aigner-01-8fddb8eca5766907.gif,,"Extremes Wetter im Frühling trifft Wälder, Felder und Ernten hart und die Ursache dahinter ist komplexer als viele denken.
Im April regnete es nur gut die Hälfte der Menge, die im langjährigen Mitte… [+9693 chars]",,2026-05-08 16:23:47+00:00,wmo,Switzerland,WCE,Europe
e4882fc69bee18ed8f138f44a448486b,2026-05-06T03:30:00Z,Snow&Ice,Frost Schweiz,www.nzz.ch,de,0.8,"INTERVIEW - Der Brexit-Chefunterhändler David Frost zum EU-Paket: «Ich würde den Schweizern sagen: Seid vorsichtig!». Die dynamische Rechtsübernahme werde den Spielraum der Schweiz einengen, sagt Lord Frost. Grossbritannien habe die Möglichkeiten nach dem Brexit schlecht genutzt.",INTERVIEW - Der Brexit-Chefunterhändler David Frost zum EU-Paket: «Ich würde den Schweizern sagen: Seid vorsichtig!»,"Die dynamische Rechtsübernahme werde den Spielraum der Schweiz einengen, sagt Lord Frost. Grossbritannien habe die Möglichkeiten nach dem Brexit schlecht genutzt.","INTERVIEW - Chief Brexit negotiator David Frost on the EU package: “I would say to the Swiss: Be careful!”. The dynamic adoption of the law will restrict Switzerland's scope, says Lord Frost. Great Britain made poor use of the opportunities after Brexit.","CONLOQUIUM - Dux Brexit negotiatoris David Frost in involucro UE: ""Dicebam Helvetiae: Cave!"" Adoptio dynamica legis scopo Helvetiae restringet, dicit Dominus Frontinus. Magna Britannia post Brexit occasiones pauperum usus fecit.",https://www.nzz.ch/schweiz/der-brexit-chefunterhaendler-david-frost-zum-eu-paket-ich-wuerde-den-schweizern-sagen-seid-vorsichtig-ld.10005138,"https://img-msp-prod.nzz.ch/2024/01/16/cc04b83b-1634-4ce4-a422-3ad7df588da5.jpeg?width=1200&height=675&fit=bounds&quality=75&auto=webp&crop=4385,2467,x0,y227&wmark=nzz",,"Die dynamische Rechtsübernahme werde den Spielraum der Schweiz einengen, sagt Lord Frost. Grossbritannien habe die Möglichkeiten nach dem Brexit schlecht genutzt.
Zusammenfassung
Merken
Der Prozes… [+12310 chars]",,2026-05-08 16:23:47+00:00,wmo,Switzerland,WCE,Europe
1e2e25abf4808ca47f0d1c4e74bc23bc,2026-05-04T10:12:16Z,Thunderstorm,Gewitter Deutschland,www.stern.de,de,0.8,"Wetter: Im Norden kalt und im Süden warm: Wetter bleibt wechselhaft. Offenbach - Deutschland steht eine wechselhafte Woche mit Gewittern und Starkregen bevor. Im Norden wird es empfindlich kühl, während es im Süden",Wetter: Im Norden kalt und im Süden warm: Wetter bleibt wechselhaft,"Offenbach - Deutschland steht eine wechselhafte Woche mit Gewittern und Starkregen bevor. Im Norden wird es empfindlich kühl, während es im Süden","Weather: Cold in the north and warm in the south: weather remains changeable. Offenbach - Germany is facing a changeable week with thunderstorms and heavy rain. In the north it will be very cold, while in the south","Tempestas: frigus in septentrione et calidum in austro: tempestas mutabilis manet. Offenbach - Germania hebdomade mutabili cum tonitribus et pluvia gravis est. in septentrione frigidissima erit, in meridie",https://www.stern.de/panorama/wetter--im-norden-kalt-und-im-sueden-warm--wetter-bleibt-wechselhaft-37366212.html,https://image.stern.de/37366214/t/AF/v1/w1440/r1.7778/-/04--2i265ud5fhv11axs2048jpeg---461a59d7ae956eba.jpg,,"Kopiere den aktuellen Link
Zur Merkliste hinzufügen
Im Norden wird es nachts empfindlich kühl, im Süden bleibt es sommerlich. Der DWD erklärt, was dahintersteckt.
Deutschland steht eine wechselhaf… [+1745 chars]",,2026-05-09 07:17:38+00:00,wmo,Germany,WCE,Europe
b0b795b0fca427f520b1380f9daa2052,2026-05-05T13:02:10Z,Thunderstorm,Gewitter Deutschland,www.tagesspiegel.de,de,0.8,"Wettervorhersage: Gewitter ziehen über Teile Deutschlands - Starkregen möglich. Lange war es viel zu trocken, nun kann sehr viel Regen auf einmal fallen. Am Nachmittag liegen Warnungen für zahlreiche Regionen in Deutschland vor.",Wettervorhersage: Gewitter ziehen über Teile Deutschlands - Starkregen möglich,"Lange war es viel zu trocken, nun kann sehr viel Regen auf einmal fallen. Am Nachmittag liegen Warnungen für zahlreiche Regionen in Deutschland vor.","Weather forecast: Thunderstorms are moving across parts of Germany - heavy rain possible. It was far too dry for a long time, now a lot of rain can fall at once. In the afternoon there are warnings for numerous regions in Germany.","Tempestas praenuntietur: Tempestates per partes Germaniae moventes - pluviae graves fieri possunt. Longe nimis siccum erat diu, nunc multum imbres statim cadere possunt. Post meridiem multae regiones in Germania monitae sunt.",https://www.tagesspiegel.de/gesellschaft/panorama/wettervorhersage-gewitter-ziehen-uber-teile-deutschlands-starkregen-moglich-15558965.html,https://www.tagesspiegel.de/images/15558964/alternates/BASE_16_9_W1400/1777986129000/dunkle-wolken-uber-kloster-eberbach.jpeg,,Nach langer Trockenheit sagt der Deutsche Wetterdienst (DWD) Gewitter und möglichen Starkregen für Teile Deutschlands voraus. Am Nachmittag lagen Warnungen vor markantem Wetter in zahlreichen Regione… [+934 chars],,2026-05-09 07:17:38+00:00,wmo,Germany,WCE,Europe
cc00b4ac2395eedf2c6233f08a5a34de,2026-05-06T15:50:16Z,Thunderstorm,Unwetter Deutschland,www.bild.de,de,0.8,"Starkregen, Hagel und Gewitter - Amtliche Unwetterwarnung für Teile von Deutschland. Starkregen, Gewitter, Hagel, heftige Sturmböen: Der Deutsche Wetterdienst hat am Mittwochnachmittag eine amtliche Unwetterwarnung herausgegeben.","Starkregen, Hagel und Gewitter - Amtliche Unwetterwarnung für Teile von Deutschland","Starkregen, Gewitter, Hagel, heftige Sturmböen: Der Deutsche Wetterdienst hat am Mittwochnachmittag eine amtliche Unwetterwarnung herausgegeben.","Heavy rain, hail and thunderstorms - official severe weather warning for parts of Germany. Heavy rain, thunderstorms, hail, violent squalls: The German Weather Service issued an official severe weather warning on Wednesday afternoon.","Imbribus gravis, grando et tonitribus - officialis gravis tempestatis admonitio in partibus Germaniae. Imbribus gravis, tonitribus, grando, procellae procellae: Ministerium Tempestatis Germanicae denuntiavit officialem tempestatem gravem die Mercurii post meridiem monentem.",https://www.bild.de/news/wetter/unwetterwarnung-fuer-deutschland-starkregen-hagel-und-gewitter-am-mittwoch-69f9bed723e6b3dbf3c998f5,"https://images.bild.de/69f9bed723e6b3dbf3c998f5/a814221cc7f91830e8e1ece2b9bea62c,8f646b4d?w=1280",,"TTS-Player überspringenArtikel weiterlesenDer Deutsche Wetterdienst hat am Mittwochnachmittag für Teile von Deutschland eine amtliche Unwetterwarnung herausgegeben. Es ist mit schweren Gewittern, Sta… [+3881 chars]",,2026-05-09 07:17:38+00:00,wmo,Germany,WCE,Europe
0b9ab1ca77c4892b12a38e6dc172319e,2026-05-08T08:38:35Z,Drought,Trockenheit Österreich,www.diepresse.com,de,0.8,Trockenheit bedroht die Untere Lobau im Nationalpark Donau-Auen. Die Naturschutzorganisation WWF warnt vor der anhaltenden Trockenheit in Österreich. Es herrsche eine ernsthafte Gefahr für die Biodiversität und ökologische Funktion der Au.,Trockenheit bedroht die Untere Lobau im Nationalpark Donau-Auen,Die Naturschutzorganisation WWF warnt vor der anhaltenden Trockenheit in Österreich. Es herrsche eine ernsthafte Gefahr für die Biodiversität und ökologische Funktion der Au.,Drought threatens the Lower Lobau in the Donau-Auen National Park. The nature conservation organization WWF warns of the ongoing drought in Austria. There is a serious threat to the biodiversity and ecological function of the floodplain.,Siccitas inferiori Lobau in National Park Donau-Auen imminet. Qualis ordo conservationis WWF siccitatis permanentis in Austria monet. Gravis comminatio biodiversitatis et oecologicae functionis diluvii est.,https://www.diepresse.com/22919640/trockenheit-bedroht-die-untere-lobau-im-nationalpark-donau-auen,https://img.diepresse.com/public/incoming/24d28z-31221d020jpg/alternates/WEBP_WIDE_1200/31221d020.jpg,,"Die anhaltende Trockenheit in Österreich setzt auch der Unteren Lobau im Nationalpark Donau-Auen zu. Davor warnte die Naturschutzorganisation WWF am Freitag und rief dabei die Stadt Wien dazu auf, Ge… [+2069 chars]",,2026-05-09 20:57:13+00:00,edo,Austria,WCE,Europe
e71b98b3ca8aa90c42b05a2bfdb49c3d,2026-05-08T09:37:31Z,Drought,Trockenheit Österreich,www.diepresse.com,de,0.8,Wal in der Lobau gestrandet. Die Trockenheit in Österreich fordert erste Opfer. Ein Buckelwal sitzt nun in der Lobau auf dem Trockenen. Das „Pizzicato“ war live dabei.,Wal in der Lobau gestrandet,Die Trockenheit in Österreich fordert erste Opfer. Ein Buckelwal sitzt nun in der Lobau auf dem Trockenen. Das „Pizzicato“ war live dabei.,Whale stranded in the Lobau. The drought in Austria is claiming its first victims. A humpback whale is now sitting on dry land in the Lobau. The “Pizzicato” was there live.,"Cete in Lobau destitutus. Siccitas in Austria primas suas victimas petit. Cetus gibbosus nunc in sicco loco sedet in Lobau. ""Pizzicato"" ibi habito.",https://www.diepresse.com/22946544/wal-in-der-lobau-gestrandet,https://img.diepresse.com/public/incoming/wkigzv-zicksee/alternates/WEBP_WIDE_1200/Zicksee,,"Die Trockenheit in Österreich hat nun auch erste Auswirkungen auf das Tierleben in den österreichischen Gewässern. So wurde in der Lobau ein Buckelwal entdeckt, der offenbar wegen des niedrigen Wasse… [+1252 chars]",,2026-05-09 20:57:13+00:00,edo,Austria,WCE,Europe
7165247783219ed42eb736488d183ee5,2026-05-04T06:37:03Z,Snow&Ice,Eis Italien,www.welt.de,de,0.1,„Ein Meisterwerk des Fahrens und der mentalen Stärke“. Dritter Sieg in Folge – und erst 19 Jahre alt: Die Formel-1-Welt verneigt sich vor Mercedes-Pilot Kim Antonelli. Die internationalen Medien feiern den Italiener nach dessen Sieg beim Großen Preis von Miami.,„Ein Meisterwerk des Fahrens und der mentalen Stärke“,Dritter Sieg in Folge – und erst 19 Jahre alt: Die Formel-1-Welt verneigt sich vor Mercedes-Pilot Kim Antonelli. Die internationalen Medien feiern den Italiener nach dessen Sieg beim Großen Preis von Miami.,“A masterpiece of driving and mental strength”. Third victory in a row – and only 19 years old: The Formula 1 world bows to Mercedes driver Kim Antonelli. The international media celebrates the Italian after his victory at the Miami Grand Prix.,"""Pagina de vi mentis et depellendi"". Tertia victoria in ordine – et tantum 19 annorum: Formula 1 mundi inclinat ad Mercedem aurigam Kim Antonelli. Instrumenta internationalia Italiae post victoriam apud Miami Grandem Prix celebrat.",https://www.welt.de/sport/formel1/article69f8362c23e6b3dbf3c981ca/formel-1-pressestimmen-ein-meisterwerk-des-fahrens-und-der-mentalen-staerke.html,https://images.welt.de/69f8362c23e6b3dbf3c981ca/89a250cf130ac28392be0d3a6f3b7027-master/ci16x9-w1200/dpa-com-260503-99-316495-jpg,,Dritter Sieg in Folge und erst 19 Jahre alt: Die Formel-1-Welt verneigt sich vor Mercedes-Pilot Kim Antonelli. Die internationalen Medien feiern den Italiener nach dessen Sieg beim Großen Preis von M… [+5935 chars],,2026-05-11 08:31:59+00:00,wmo,Italy,MED,Europe
e7f3e2fd338a5fdec72e7b68583879c1,2026-05-04T07:11:36Z,Precipitation,Regen Schweiz,www.stern.de,de,0.8,Nationalpark Böhmische Schweiz: Brand nahe Sachsen nicht unter Kontrolle - Hoffen auf Regen. Zwei Black-Hawk-Hubschrauber aus der Slowakei unterstützen den Einsatz in Tschechien. Was steckt hinter dem Kampf gegen das Feuer in der Böhmischen Schweiz? Die Hoffnung ruht auf Niederschlägen.,Nationalpark Böhmische Schweiz: Brand nahe Sachsen nicht unter Kontrolle - Hoffen auf Regen,Zwei Black-Hawk-Hubschrauber aus der Slowakei unterstützen den Einsatz in Tschechien. Was steckt hinter dem Kampf gegen das Feuer in der Böhmischen Schweiz? Die Hoffnung ruht auf Niederschlägen.,Bohemian Switzerland National Park: Fire near Saxony not under control - hoping for rain. Two Black Hawk helicopters from Slovakia are supporting the operation in the Czech Republic. What is behind the fight against fire in Bohemian Switzerland? Hope rests on precipitation.,National Park Bohemica Helvetia: Ignis prope Saxoniam non moderatus - pluviam sperans. Duo helicopteri Niger Hawk ex Slovakia operationem in Res publica Bohemica sustinent. Quid est post pugnam contra incendium in Helvetia Bohemica? Spes est in praecipitatione.,https://www.stern.de/gesellschaft/regional/sachsen/nationalpark-boehmische-schweiz--brand-nahe-sachsen-nicht-unter-kontrolle---hoffen-auf-regen-37365338.html,https://image.stern.de/37365340/t/Yd/v1/w1440/r1.7778/-/04--qkrxjal7gyv3axs2048jpeg---ad71070cf254d143.jpg,,"Kopiere den aktuellen Link
Zur Merkliste hinzufügen
Zwei Black-Hawk-Hubschrauber aus der Slowakei unterstützen den Einsatz in Tschechien. Was steckt hinter dem Kampf gegen das Feuer in der Böhmisch… [+1609 chars]",,2026-05-11 08:31:59+00:00,wmo,Switzerland,WCE,Europe
47137f654398a5ebbde644177f5cdc91,2026-05-04T07:11:36Z,Precipitation,Regen Schweiz,www.zeit.de,de,0.8,Nationalpark Böhmische Schweiz: Brand nahe Sachsen nicht unter Kontrolle - Hoffen auf Regen. Hier finden Sie Informationen zu dem Thema „Nationalpark Böhmische Schweiz“. Lesen Sie jetzt „Brand nahe Sachsen nicht unter Kontrolle - Hoffen auf Regen“.,Nationalpark Böhmische Schweiz: Brand nahe Sachsen nicht unter Kontrolle - Hoffen auf Regen,Hier finden Sie Informationen zu dem Thema „Nationalpark Böhmische Schweiz“. Lesen Sie jetzt „Brand nahe Sachsen nicht unter Kontrolle - Hoffen auf Regen“.,Bohemian Switzerland National Park: Fire near Saxony not under control - hoping for rain. Here you will find information on the topic “Bohemian Switzerland National Park”. Now read “Fire near Saxony not under control – hoping for rain”.,"National Park Bohemica Helvetia: Ignis prope Saxoniam non moderatus - pluviam sperans. Hic informationes invenies in themate ""Helvetiorum Bohemorum National Park"". Nunc legitur ""Ignis prope Saxoniam non moderata - sperans pluviam"".",https://www.zeit.de/news/2026-05/04/brand-nahe-sachsen-nicht-unter-kontrolle-hoffen-auf-regen,https://img.zeit.de/news/2026-05/04/brand-nahe-sachsen-nicht-unter-kontrolle-hoffen-auf-regen-image-group/wide__1300x731,,Der Waldbrand im tschechischen Nationalpark Böhmische Schweiz nahe der Grenze zu Sachsen breitet sich aktuell nicht weiter aus. Nach Angaben der Behörden ist er aber bisher nicht unter Kontrolle. «Da… [+1463 chars],,2026-05-11 08:31:59+00:00,wmo,Switzerland,WCE,Europe
4d9385df2ae7e922460c6970d4558c14,2026-05-03T10:28:06Z,Snow&Ice,Frostvouvry,www.bild.de,de,0.8,Nahe der deutschen Grenze - Mega-Waldbrand in Wanderparadies. 500 Feuerwehrleute kämpfen gegen Flammen in Böhmischer Schweiz – dem beliebten Wanderparadies.,Nahe der deutschen Grenze - Mega-Waldbrand in Wanderparadies,500 Feuerwehrleute kämpfen gegen Flammen in Böhmischer Schweiz – dem beliebten Wanderparadies.,Near the German border - mega forest fire in hiking paradise. 500 firefighters are fighting flames in Bohemian Switzerland – the popular hiking paradise.,Prope fines German - mega ignis in paradiso silvae hiking. 500 Firefighters in Bohemia Bohemica Helvetia populari hiking paradisi flammae pugnant.,https://www.bild.de/regional/sachsen/sachsen-mega-waldbrand-nahe-deutscher-grenze-69f70c43db1aeefad1dbc4e6,"https://images.bild.de/69f70c43db1aeefad1dbc4e6/a6e56475c6eff60bb03fee5a4180e3aa,6d6ada7d?w=1280",,TTS-Player überspringenArtikel weiterlesenTetschen (Tschechien) Inferno im Wanderparadies: In der berühmten Böhmischen Schweiz tobt auf 100 Hektar ein schwerer Waldbrand. Hunderte Feuerwehrleute aus … [+3222 chars],,2026-05-12 07:51:03+00:00,wmo,Switzerland,WCE,Europe
8450bccd0faca8f444f0691ca849c438,2026-05-04T11:23:00Z,Storm,Sturmflut Wien brodelnd,www.stern.de,de,0.8,Waldbrände: Dürreexperte warnt: „Deutschland im Moment ungewöhnlich trocken“. Zahlreiche Wälder standen am Wochenende in Deutschland in Flammen. Ein Experte erklärt Brandenburg zum „Waldbrandgefahren-Hotspot“. Was die Situation schnell ändern kann.,Waldbrände: Dürreexperte warnt: „Deutschland im Moment ungewöhnlich trocken“,Zahlreiche Wälder standen am Wochenende in Deutschland in Flammen. Ein Experte erklärt Brandenburg zum „Waldbrandgefahren-Hotspot“. Was die Situation schnell ändern kann.,Forest fires: Drought expert warns: “Germany is unusually dry at the moment”. Numerous forests were on fire in Germany over the weekend. An expert declares Brandenburg a “forest fire danger hotspot”. What can change the situation quickly.,"Silvae ignes: Siccitas doctissima monet: ""Germania in tempore solito sicca"". Multae silvae in Germania super weekend incendebantur. Peritus Brandenburgicus declarat ""salvam ignis periculum hotspot"". Quae res cito mutare potest.",https://www.stern.de/panorama/duerreexperte---deutschland-ungewoehnlich-trocken----viele-waldbraende-37366414.html,https://image.stern.de/37366476/t/F-/v3/w1440/r1.7778/-/waldbrand-in-deutschland-in-jueterbog.jpg,,"Kopiere den aktuellen Link
Zur Merkliste hinzufügen
Zahlreiche Wälder standen am Wochenende in Deutschland in Flammen. Ein Experte erklärt Brandenburg zum Waldbrandgefahren-Hotspot. Was die Situati… [+1573 chars]",,2026-05-12 07:51:03+00:00,wmo,Austria,WCE,Europe
9c507817aec69f6e95a17c27802f9bd3,2026-05-04T14:23:21Z,Snow&Ice,eiskalte Freude,www.tagesschau.de,de,0.8,"Deutschland und Tschechien: Viele Waldbrände wegen Trockenheit. Waldbrände im brandenburgischen Jüterbog, in den bayerischen Alpen, in der Böhmischen Schweiz - ungewöhnlich früh im Jahr. Grund ist die extreme Trockenheit. Die Waldbrandgefahr dürfte aber schon bald deutlich zurückgehen.",Deutschland und Tschechien: Viele Waldbrände wegen Trockenheit,"Waldbrände im brandenburgischen Jüterbog, in den bayerischen Alpen, in der Böhmischen Schweiz - ungewöhnlich früh im Jahr. Grund ist die extreme Trockenheit. Die Waldbrandgefahr dürfte aber schon bald deutlich zurückgehen.","Germany and the Czech Republic: Many forest fires due to drought. Forest fires in Jüterbog in Brandenburg, in the Bavarian Alps, in Bohemian Switzerland - unusually early in the year. The reason is the extreme dryness. However, the risk of forest fires should soon decrease significantly.","Germania et Res publica Bohemica: Multi ignes silvae ob siccitatem. Ignes silvae in Jüterbog in Brandenburg, in Alpibus Bavaricis, in Helvetia Bohemica - primo anno solito. Ratio est extrema siccitas. Sed periculum incendium silvarum mox insigniter decrescere debet.",https://www.tagesschau.de/inland/gesellschaft/waldbraende-duerre-100.html,https://images.tagesschau.de/image/00534ea1-8d63-47d5-aa6c-d9feaf523ff6/AAABnfNfR_M/AAABnSSvrFg/16x9-big/waldbrand-chiemgau-100.jpg?width=1280,,"Stand: 04.05.2026 16:23 Uhr
Waldbrände im brandenburgischen Jüterbog, in den bayerischen Alpen, in der Böhmischen Schweiz - ungewöhnlich früh im Jahr. Grund ist die extreme Trockenheit. Die Waldbran… [+4100 chars]",,2026-05-12 07:51:03+00:00,wmo,Switzerland,WCE,Europe
9801534658109b8a10dd244dca604fb0,2026-05-09T06:34:24Z,Drought,Trockenperiode Österreich,science.orf.at,de,0.8,"Bessere Vorhersage saisonaler Trockenheit. Der vergangene Winter war zu mild und zu trocken und auch der Frühlingsbeginn brachte kaum Regen – eine saisonale Trockenperiode, die Ökosysteme und Landwirtschaft in vielen Regionen Österreichs derzeit belastet. Bessere Prognosewerkzeuge sollen hier Abhilfe …",Bessere Vorhersage saisonaler Trockenheit,"Der vergangene Winter war zu mild und zu trocken und auch der Frühlingsbeginn brachte kaum Regen – eine saisonale Trockenperiode, die Ökosysteme und Landwirtschaft in vielen Regionen Österreichs derzeit belastet. Bessere Prognosewerkzeuge sollen hier Abhilfe …",Better prediction of seasonal drought. Last winter was too mild and too dry and the beginning of spring brought hardly any rain - a seasonal dry period that is currently putting a strain on ecosystems and agriculture in many regions of Austria. Better forecasting tools should help here...,"Rectius praesagium temporis siccitatis. Hiems ultima nimis lenis et nimis arida erat et initium veris vix ullam pluviam attulit - tempus tempus siccum, quod in oecosystematis et agriculturae in multis Austriae regionibus nunc est iactans. Meliora instrumenta praevidenda hic iuvare debent.",https://science.orf.at/stories/3235458/,https://ibs.orf.at/science?image=https%3A%2F%2Ftubestatic.orf.at%2Fmims%2F2026%2F19%2F72%2Fcrops%2Fw%3D1200%2Ch%3D627%2Cq%3D75%2F3030573_master_1172472_themenbild_umwelt_klima_boden_flaeche_acker_wetter_2.jpg%3Fs%3De841895a22a1f91b3bfa00c7837b86981eaf1c6f,,Wassermangel und Trockenheit haben derzeit viele Regionen in Österreich fest im Griff. Wesentliche Ursache dafür sind der Klimawandel und damit verbundene Wetterveränderungen. Aktuelle Analysen des e… [+3677 chars],,2026-05-12 17:20:28+00:00,edo,Austria,WCE,Europe
b218fe1e997563a2cd3211b72f682ad6,2026-05-11T08:15:00Z,Snow&Ice,Eis Schweiz,www.bild.de,de,0.1,Kader für Eishockey-WM nominiert - NHL-Star Seider im deutschen Team. Mit fünf Debütanten fährt Bundestrainer Harold Kreis (67) mit dem DEB-Team zur WM in die Schweiz.,Kader für Eishockey-WM nominiert - NHL-Star Seider im deutschen Team,Mit fünf Debütanten fährt Bundestrainer Harold Kreis (67) mit dem DEB-Team zur WM in die Schweiz.,Squad nominated for the Ice Hockey World Cup - NHL star Seider in the German team. National coach Harold Kreis (67) is traveling with the DEB team to the World Cup in Switzerland with five debutants.,Manipulus nominatus pro Hockey Mundi Calicem - NHL stella Seider in turma Germanica. Raeda nationalis Harold Kreis (67) cum DEB quadrigis ad Trophaeum Mundi in Helvetia cum quinque debutantibus iter est.,https://www.bild.de/sport/mehr-sport/kader-fuer-eishockey-wm-nominiert-nhl-star-seider-im-deutschen-team-6a018740d347a2d6b4a7e360,"https://images.bild.de/6a018740d347a2d6b4a7e360/d2edb1059249f778ccf1273bd62cb02d,4fc133df?w=1280",,TTS-Player überspringenArtikel weiterlesenJetzt ist es raus. Mit fünf Debütanten fährt Bundestrainer Harold Kreis (67) mit dem DEB-Team zur WM in die Schweiz. Nach dem letzten Testspiel gegen die USA… [+1349 chars],,2026-05-12 21:26:27+00:00,wmo,Switzerland,WCE,Europe
bbf7398f9456679c18d6ef0299e6b756,2026-05-11T10:24:53Z,Snow&Ice,Eis Schweiz,www.sueddeutsche.de,de,0.1,"Deutsche Eishockey-Nationalmannschaft: Mit fünf Neulingen zur WM. Nur 13 Spieler der deutschen Olympia-Auswahl finden sich im Kader für die WM in der Schweiz wieder. Trotz zahlreicher Absagen, unter anderem von Leon Draisaitl, hält Bundestrainer Kreis am Ziel Viertelfinale fest.",Deutsche Eishockey-Nationalmannschaft: Mit fünf Neulingen zur WM,"Nur 13 Spieler der deutschen Olympia-Auswahl finden sich im Kader für die WM in der Schweiz wieder. Trotz zahlreicher Absagen, unter anderem von Leon Draisaitl, hält Bundestrainer Kreis am Ziel Viertelfinale fest.","German national ice hockey team: with five newcomers to the World Cup. Only 13 players from the German Olympic team are in the squad for the World Cup in Switzerland. Despite numerous rejections, including from Leon Draisaitl, national coach Kreis is sticking to his goal of the quarter-finals.","Societates nationales Germanicae glaciei hockey: cum quinque advenis ad Trophaeum Mundi. Solus XIII lusores ex theatro Olympico Germanico in MANIPLUS Mundi in Helvetia sunt. Quamvis multae reiectiones, excepta Leon Draisaitl, raeda nationalis Kreis suo fini quartae finalis adhaeret.",https://www.sueddeutsche.de/sport/eishockey-wm-schweiz-start-deb-aufgebot-absagen-li.3481739,https://www.sueddeutsche.de/2026/05/11/67996ed5-a465-49db-8c96-19b48815a37a.jpg?q=60&fm=webp&width=1200&rect=0%2C0%2C4000%2C2250,,"Hervorragend ist eine Vokabel, die Harold Kreis nicht so oft entkommt. Sosehr sich der Eishockey-Bundestrainer mit persönlicher Kritik zurückhält, so lobt er seine Spieler zwar immer eifrig. Aber ein… [+3492 chars]",,2026-05-12 21:26:27+00:00,wmo,Switzerland,WCE,Europe
